character,script_line,season,episode,begin,end,duration,episode_index,bad_words,is_male,is_character
Aureliano Adami,mo abbiamo pianto asciughiamoci le lacrime e riapriamo gli occhi,1,5,7933600000,7962400000,28800000,138,0,1.0,1
Aureliano Adami,voglio che stiamo attaccati a sti zingari di merda,1,5,7970000000,7993200000,23200000,139,1,1.0,1
Aureliano Adami,voglio sapere quanti sono dove stanno quello che fanno,1,5,8000400000,8025200000,24800000,140,0,1.0,1
Aureliano Adami,appena abbassano gli occhi li ammazziamo tutti,1,5,8032800000,8054800000,22000000,141,0,1.0,1
Aureliano Adami,uno per uno,1,5,8068000000,8078000000,10000000,142,0,1.0,1
Romolo Lucci,aurelia,1,5,8078800000,8088400000,9600000,143,0,1.0,1
Samurai Valerio,condoglianze aurelia,1,5,8238000000,8250000000,12000000,144,0,1.0,1
Aureliano Adami,grazie,1,5,8261200000,8271600000,10400000,145,0,1.0,1
Samurai Valerio,tuo padre lo conosco da quand ero pischello,1,5,8302400000,8322800000,20400000,146,0,1.0,1
Aureliano Adami,mmh,1,5,8328000000,8336400000,8400000,147,0,1.0,1
Aureliano Adami,pure io mi sa,1,5,8342800000,8353600000,10800000,148,0,1.0,1
Samurai Valerio,e mo che succede,1,5,8385600000,8396400000,10800000,149,0,1.0,1
Aureliano Adami,non lo so ci penso e te lo faccio sapere va bene,1,5,8418400000,8439600000,21200000,150,0,1.0,1
Samurai Valerio,non fare cazzate aurelia,1,5,8461600000,8480000000,18400000,151,1,1.0,1
Aureliano Adami,e no samurai le cazzate le hanno fatte gli altri mo devo sistemare le cose,1,5,8507200000,8543200000,36000000,152,1,1.0,1
Aureliano Adami,e tu non mi devi rompere il cazzo,1,5,8572800000,8591600000,18800000,153,1,1.0,1
Samurai Valerio,tullio ha sempre voluto te come capo,1,5,8995600000,9014400000,18800000,154,0,1.0,1
Aureliano Adami,vieni qua mettiti a sedere,1,5,9567200000,9581200000,14000000,157,0,1.0,1
Aureliano Adami,ma com è che samurai non abbraccia me,1,5,9612400000,9628400000,16000000,158,0,1.0,1
Livia Adami,falla finita aurelia,1,5,9633600000,9647600000,14000000,159,0,0.0,1
Livia Adami,perché hai preso i soldi di papà,1,5,9675600000,9690000000,14400000,160,0,0.0,1
Aureliano Adami,perché ci dobbiamo vendicare,1,5,9710800000,9724000000,13200000,161,0,1.0,1
Livia Adami,e lo dovevo scoprire da sola,1,5,9729600000,9742400000,12800000,162,0,0.0,1
Aureliano Adami,gli impicci che facevate tu e papà con samurai come li ho scoperti,1,5,9743200000,9770400000,27200000,163,0,1.0,1
Livia Adami,quello è un affare molto più grosso,1,5,9771200000,9808400000,37200000,164,0,0.0,1
Aureliano Adami,va bene ma basta è passato,1,5,9771200000,9808400000,37200000,165,0,1.0,1
Aureliano Adami,le cose cambiano io ho una guerra da fare,1,5,9826400000,9845200000,18800000,166,0,1.0,1
Ezio Quirino,ma di che guerra stai a parlare,1,5,9846000000,9858800000,12800000,167,0,1.0,1
Aureliano Adami,non t hanno insegnato a scuola che per parlare devi alzare la mano,1,5,9891600000,9920400000,28800000,168,0,1.0,1
Aureliano Adami,io la tua non l ho vista,1,5,9930800000,9949200000,18400000,169,0,1.0,1
Livia Adami,per favore,1,5,9930800000,9949200000,18400000,170,0,0.0,1
Aureliano Adami,aspetta fallo parlare,1,5,9950000000,9963200000,13200000,171,0,1.0,1
Ezio Quirino,se mi posso permettere sono sette anni che seguo i conti di questa famiglia,1,5,9985600000,10019200000,33600000,172,0,1.0,1
Ezio Quirino,sette anni giorno e notte appiccicato a tuo padre,1,5,10020000000,10043200000,23200000,173,0,1.0,1
Aureliano Adami,bravo,1,5,10044000000,10052400000,8400000,174,0,1.0,1
Aureliano Adami,mo vattene affanculo,1,5,10062000000,10075600000,13600000,175,1,1.0,1
Aureliano Adami,e non tornare più che le guerre non si fanno col pallottoliere,1,5,10078800000,10104000000,25200000,176,0,1.0,1
Samurai Valerio,a che punto stanno i lavori in commissione,1,5,10198000000,10223600000,25600000,177,0,1.0,1
Sara Monaschi,il monsignore si è preso qualche giorno di riposo,1,5,10243599999,10265600000,22000001,178,0,0.0,1
Sara Monaschi,è anche comprensibile dopo quello che ha passato,1,5,10280000000,10301600000,21600000,179,0,0.0,1
Samurai Valerio,sì ma il tempo sta per finire si riposerà dopo,1,5,10309200000,10337600000,28400000,180,0,1.0,1
Samurai Valerio,ora deve firmare le carte,1,5,10342000000,10357200000,15200000,181,0,1.0,1
Sara Monaschi,proverò a sentirlo,1,5,10369200000,10386800000,17600000,182,0,0.0,1
Sara Monaschi,ma purtroppo non so dove sia,1,5,10390799999,10405200000,14400001,183,0,0.0,1
Samurai Valerio,io invece credo di sì,1,5,10460000000,10475600000,15600000,184,0,1.0,1
Samurai Valerio,ho paura che lei stia seguendo i consigli sbagliati,1,5,10496400000,10523200000,26800000,185,0,1.0,1
Sara Monaschi,che vuol dire,1,5,10538400000,10547200000,8800000,186,0,0.0,1
Samurai Valerio,il tempo finisce per tutti pure per lei,1,5,10548000000,10569200000,21200000,187,0,1.0,1
Samurai Valerio,è meglio che lo trovi,1,5,10596400000,10608400000,12000000,188,0,1.0,1
Amedeo Cinaglia,e quant è che lavora con il dott taccon,1,5,11313600000,11334000000,20400000,191,0,1.0,1
Amedeo Cinaglia,no è solo che il dottore mi sembra un tipo piuttosto riservato,1,5,11359600000,11387200000,27600000,194,0,1.0,1
Amedeo Cinaglia,me ne sono accorto,1,5,11440800000,11452800000,12000000,197,0,1.0,1
Amedeo Cinaglia,infatti volevo trovare il modo per entrarci un po in sintonia,1,5,11457200000,11481600000,24400000,198,0,1.0,1
Amedeo Cinaglia,visto che dobbiamo lavorare insieme,1,5,11482400000,11499600000,17200000,199,0,1.0,1
Amedeo Cinaglia,non è che lei ha qualche consiglio da darmi,1,5,11525200000,11543200000,18000000,200,0,1.0,1
Amedeo Cinaglia,sì,1,5,11591200000,11599600000,8400000,202,0,1.0,1
Livia Adami,dove sta,1,5,12546400000,12557600000,11200000,205,0,0.0,1
Livia Adami,ancora qua stai,1,5,12652400000,12664400000,12000000,206,0,0.0,1
Ezio Quirino,non ti lascio sola livia,1,5,12675600000,12689600000,14000000,207,0,1.0,1
Livia Adami,stai qua solo per difendere il posto tuo,1,5,12704400000,12724000000,19600000,208,0,0.0,1
Ezio Quirino,sto qua per difendere te,1,5,12746000000,12760000000,14000000,209,0,1.0,1
Ezio Quirino,e il futuro tuo,1,5,12764800000,12773600000,8800000,210,0,1.0,1
Ezio Quirino,non puoi lasciare la famiglia in mano a un pazzo del genere,1,5,12777200000,12803600000,26400000,211,0,1.0,1
Livia Adami,tu e mio fratello siete uguali sempre a pensare a sto cazzo di futuro,1,5,12812000000,12845200000,33200000,212,1,0.0,1
Livia Adami,papà non l abbiamo ancora seppellito,1,5,12850400000,12867200000,16800000,213,0,0.0,1
Ezio Quirino,è proprio per tuo padre che devi reagire,1,5,12868000000,12886400000,18400000,214,0,1.0,1
Ezio Quirino,lui si fidava solo di te,1,5,12896800000,12908800000,12000000,215,0,1.0,1
Livia Adami,tu non lo devi nominare mio padre,1,5,12909600000,12924400000,14800000,216,0,0.0,1
Livia Adami,e mo vattene,1,5,12935600000,12946400000,10800000,217,0,0.0,1
Livia Adami,lasciami stare,1,5,12962800000,12973600000,10800000,218,0,0.0,1
Ezio Quirino,la cravatta sta sotto il vestito nero,1,5,13019200000,13036000000,16800000,219,0,1.0,1
Samurai Valerio,tutto bene,1,5,13226800000,13235200000,8400000,220,0,1.0,1
Samurai Valerio,la pistola,1,5,13273600000,13283600000,10000000,221,0,1.0,1
Gabriele Marchilli,in fondo al mare,1,5,13305200000,13318000000,12800000,222,0,1.0,1
Samurai Valerio,non sarà che ti ho trovato un talento che non sapevi di avere,1,5,13350800000,13378800000,28000000,223,0,1.0,1
Gabriele Marchilli,il debito l ho pagato siamo a posto,1,5,13402400000,13430400000,28000000,224,0,1.0,1
Samurai Valerio,a posto,1,5,13437600000,13447200000,9600000,225,0,1.0,1
Gabriele Marchilli,bene allora io posso andare,1,5,13462000000,13478000000,16000000,226,0,1.0,1
Samurai Valerio,no,1,5,13485600000,13494000000,8400000,227,0,1.0,1
Samurai Valerio,hai ucciso un boss su ordine mio,1,5,13500000000,13521200000,21200000,228,0,1.0,1
Samurai Valerio,perché sei ancora vivo lo sai,1,5,13536400000,13552800000,16400000,229,0,1.0,1
Samurai Valerio,perché mi servi ancora,1,5,13566000000,13577600000,11600000,230,0,1.0,1
Samurai Valerio,tu da oggi sei gli occhi e le orecchie mie dentro la famiglia adami,1,5,13598000000,13628000000,30000000,231,0,1.0,1
Samurai Valerio,mi devi dire tutto soprattutto quello che fa aureliano,1,5,13632800000,13661200000,28400000,232,0,1.0,1
Samurai Valerio,hai capito,1,5,13674800000,13683200000,8400000,233,0,1.0,1
Samurai Valerio,ora puoi andare,1,5,13722800000,13732400000,9600000,234,0,1.0,1
Aureliano Adami,grazie di essere passato,1,5,14385200000,14400800000,15600000,243,0,1.0,1
Gabriele Marchilli,mi dispiace,1,5,14414400000,14423600000,9200000,244,0,1.0,1
Gabriele Marchilli,chi è stato lo sai,1,5,14470800000,14482000000,11200000,245,0,1.0,1
Aureliano Adami,gli zingari chi vuoi che è stato,1,5,14490800000,14505600000,14800000,246,0,1.0,1
Gabriele Marchilli,e adesso,1,5,14552800000,14562000000,9200000,247,0,1.0,1
Gabriele Marchilli,che vuoi fare,1,5,14569200000,14580400000,11200000,248,0,1.0,1
Aureliano Adami,li voglio ammazzare tutti,1,5,14584800000,14598000000,13200000,249,0,1.0,1
Gabriele Marchilli,e tu,1,5,14668400000,14677600000,9200000,250,0,1.0,1
Gabriele Marchilli,come stai,1,5,14690000000,14701200000,11200000,251,0,1.0,1
Aureliano Adami,come quando odii qualcuno,1,5,14719200000,14735200000,16000000,252,0,1.0,1
Aureliano Adami,all improvviso non ci sta più,1,5,14794400000,14810800000,16400000,253,0,1.0,1
Aureliano Adami,e ti accorgi che ti manca,1,5,14836400000,14853600000,17200000,254,0,1.0,1
Aureliano Adami,perché non lo puoi neanche più odiare,1,5,14886800000,14905200000,18400000,255,0,1.0,1
Gabriele Marchilli,comunque io sto qua,1,5,15011200000,15021600000,10400000,256,0,1.0,1
Aureliano Adami,mo comando io,1,5,15194800000,15206000000,11200000,257,0,1.0,1
Aureliano Adami,e lo devono sapere tutti,1,5,15253200000,15266000000,12800000,258,0,1.0,1
Contessa Sveva Della Rocca Croce,com è andata,1,5,15448000000,15458400000,10400000,261,0,0.0,1
Contessa Sveva Della Rocca Croce,com è andata con samurai,1,5,15472400000,15488400000,16000000,262,0,0.0,1
Sara Monaschi,dice che ha fretta,1,5,15497600000,15510000000,12400000,263,0,0.0,1
Sara Monaschi,sospetta e mi ha anche minacciata,1,5,15520800000,15540400000,19600000,264,0,0.0,1
Contessa Sveva Della Rocca Croce,appena taccon scopre chi c è dietro le sue ditte,1,5,15541200000,15566400000,25200000,265,0,0.0,1
Contessa Sveva Della Rocca Croce,vedrai come samurai torna educato,1,5,15567200000,15586400000,19200000,266,0,0.0,1
Contessa Sveva Della Rocca Croce,e allora tratterà,1,5,15593200000,15605200000,12000000,267,0,0.0,1
Contessa Sveva Della Rocca Croce,sara tu sei distratta che succede,1,5,15626400000,15651200000,24800000,268,0,0.0,1
Contessa Sveva Della Rocca Croce,è per samurai o c è dell altro,1,5,15658000000,15674000000,16000000,269,0,0.0,1
Sara Monaschi,ma no è che sono preoccupata,1,5,15681200000,15700800000,19600000,270,0,0.0,1
Contessa Sveva Della Rocca Croce,non è che mi sto sbagliando a scommettere tutto su di te,1,5,15737600000,15766800000,29200000,271,0,0.0,1
Contessa Sveva Della Rocca Croce,il mio solito tè bianco con una puntina di zenzero,1,5,15782400000,15813600000,31200000,273,0,0.0,1
Sara Monaschi,per me lo stesso grazie,1,5,15831600000,15844000000,12400000,274,0,0.0,1
Sara Monaschi,perché vuole fregare samurai,1,5,15870000000,15889200000,19200000,275,0,0.0,1
Contessa Sveva Della Rocca Croce,perché lui ha rovinato me e mio marito,1,5,15916000000,15941200000,25200000,276,0,0.0,1
Sara Monaschi,come,1,5,15956400000,15965200000,8800000,277,0,0.0,1
Contessa Sveva Della Rocca Croce,ricordi la famosa rapina di samurai,1,5,15993600000,16011600000,18000000,278,0,0.0,1
Sara Monaschi,sì,1,5,16022400000,16030800000,8400000,279,0,0.0,1
Contessa Sveva Della Rocca Croce,il vero obiettivo non erano i gioielli ma certi documenti,1,5,16042000000,16073600000,31600000,280,0,0.0,1
Contessa Sveva Della Rocca Croce,coi gioielli ti compri mezza roma ma coi segreti te la prendi tutta,1,5,16082800000,16119200000,36400000,281,0,0.0,1
Contessa Sveva Della Rocca Croce,e lui se l è presa,1,5,16120000000,16132000000,12000000,282,0,0.0,1
Contessa Sveva Della Rocca Croce,e si è preso pure le aziende di mio marito,1,5,16136800000,16157200000,20400000,283,0,0.0,1
Contessa Sveva Della Rocca Croce,che alla fine si è ammazzato,1,5,16181600000,16200400000,18800000,284,0,0.0,1
Contessa Sveva Della Rocca Croce,tieni gli occhi aperti che samurai non l abbiamo ancora fregato,1,5,16226800000,16256000000,29200000,285,0,0.0,1
Livia Adami,hai ragione tu,1,5,16324800000,16337200000,12400000,286,0,0.0,1
Livia Adami,prima aureliano,1,5,16342400000,16352800000,10400000,287,0,0.0,1
Livia Adami,e poi gli zingari di merda,1,5,16359600000,16376800000,17200000,288,1,0.0,1
Livia Adami,una guerra alla volta,1,5,16388800000,16399600000,10800000,289,0,0.0,1
Ezio Quirino,come ti vuoi muovere,1,5,16407600000,16418800000,11200000,290,0,1.0,1
Livia Adami,aureliano si è preso i soldi che stavano in mezzo alle dune,1,5,16426800000,16454000000,27200000,291,0,0.0,1
Livia Adami,ma degli affari miei non sa un cazzo,1,5,16454800000,16472400000,17600000,292,1,0.0,1
Livia Adami,mi devi portare tutti i conti della famiglia,1,5,16482000000,16502400000,20400000,293,0,0.0,1
Livia Adami,devo sapere fino a che punto mi posso spingere,1,5,16511600000,16534000000,22400000,294,0,0.0,1
Ezio Quirino,che vuoi fare,1,5,16544800000,16554000000,9200000,295,0,1.0,1
Livia Adami,prima voglio parlare con le famiglie di ostia che lavorano per noi,1,5,16573600000,16602800000,29200000,296,0,0.0,1
Livia Adami,mi devono appoggiare,1,5,16613600000,16625200000,11600000,297,0,0.0,1
Livia Adami,che vuoi in cambio del tuo appoggio,1,5,16924800000,16944800000,20000000,300,0,0.0,1
Samurai Valerio,appoggio è una parola brutta la usano i politici,1,5,16961600000,16986000000,24400000,301,0,1.0,1
Samurai Valerio,diciamo che io ti aiuto a salire sul trono che ti spetta,1,5,16991200000,17019200000,28000000,302,0,1.0,1
Livia Adami,e in cambio,1,5,17037200000,17048800000,11600000,303,0,0.0,1
Samurai Valerio,niente più sangue,1,5,17051600000,17064800000,13200000,304,0,1.0,1
Samurai Valerio,nessuna vendetta sugli zingari,1,5,17065600000,17086000000,20400000,305,0,1.0,1
Samurai Valerio,oltre a quello che mi aveva promesso tuo padre su ostia,1,5,17093200000,17119200000,26000000,306,0,1.0,1
Livia Adami,guarda che il trono di papà non è un seggiolone,1,5,17150800000,17173200000,22400000,307,0,0.0,1
Livia Adami,e io non sono più una ragazzina,1,5,17178400000,17194800000,16400000,308,0,0.0,1
Samurai Valerio,che vuoi dire,1,5,17205600000,17217200000,11600000,309,0,1.0,1
Livia Adami,che sul trono di mio padre mi ci siedo da sola non ho bisogno dell aiuto tuo,1,5,17221200000,17254800000,33600000,310,0,0.0,1
Samurai Valerio,e che saresti venuta a fare,1,5,17262000000,17278000000,16000000,311,0,1.0,1
Livia Adami,a dirti che mio padre non lo vendico proprio come vuoi tu,1,5,17304800000,17332000000,27200000,312,0,0.0,1
Livia Adami,ma in cambio voglio l 8 sull affare di ostia,1,5,17349600000,17374000000,24400000,313,0,0.0,1
Manfredi Anacleti,fai scendere gli sposi,1,5,17636000000,17654000000,18000000,319,0,1.0,1
Adelaide Anacleti,ragazzi andate a ballare,1,5,17729600000,17754000000,24400000,322,0,0.0,1
Manfredi Anacleti,maestro,1,5,17772800000,17786000000,13200000,323,0,1.0,1
Manfredi Anacleti,maestro facciamo un lento per favore,1,5,17786800000,17823600000,36800000,324,0,1.0,1
Adelaide Anacleti,alberto è ora che inviti tua suocera a ballare,1,5,17885200000,17919200000,34000000,327,0,0.0,1
Manfredi Anacleti,mio fratello è un uomo fortunato,1,5,18127200000,18142400000,15200000,329,0,1.0,1
Manfredi Anacleti,viva gli sposi,1,5,18278400000,18299200000,20800000,330,0,1.0,1
Manfredi Anacleti,vai spadi,1,5,18332000000,18344800000,12800000,332,0,1.0,1
Aureliano Adami,che cazzo è tutta sta gente,1,5,18977200000,18993600000,16400000,336,1,1.0,1
Aureliano Adami,mo sì che ti riconosco sorellina,1,5,19405200000,19426800000,21600000,338,0,1.0,1
Aureliano Adami,che schifo mi fai,1,5,19518000000,19534000000,16000000,339,0,1.0,1
Gianni Taccon,buonasera,1,5,19786800000,19802800000,16000000,340,0,1.0,1
Amedeo Cinaglia,buonasera,1,5,19786800000,19802800000,16000000,341,0,1.0,1
Gianni Taccon,aveva bisogno di parlarmi,1,5,19829200000,19846400000,17200000,342,0,1.0,1
Amedeo Cinaglia,volevo solo capire quando potevamo vederci per coordinare i lavori,1,5,19849600000,19881600000,32000000,343,0,1.0,1
Gianni Taccon,è un po presto io devo ancora leggere tutte le carte,1,5,19884800000,19909600000,24800000,344,0,1.0,1
Gianni Taccon,adesso mi scusi,1,5,19912000000,19923600000,11600000,345,0,1.0,1
Amedeo Cinaglia,che fine ha fatto quel suo progetto sui musei di roma,1,5,19928400000,19953600000,25200000,346,0,1.0,1
Gianni Taccon,hanno scelto quello di un altro,1,5,19977600000,19993200000,15600000,347,0,1.0,1
Gianni Taccon,ma lei che ne sa,1,5,20005200000,20014000000,8800000,348,0,1.0,1
Amedeo Cinaglia,me lo ricordo bene,1,5,20018800000,20029600000,10800000,349,0,1.0,1
Amedeo Cinaglia,era un bel progetto,1,5,20034400000,20044000000,9600000,350,0,1.0,1
Amedeo Cinaglia,ci pensa mai,1,5,20060400000,20070400000,10000000,351,0,1.0,1
Gianni Taccon,si ricorda quando il comune aveva fatto mettere una gabbia,1,5,20103600000,20143200000,39600000,352,0,1.0,1
Gianni Taccon,con una lupa dentro,1,5,20144000000,20154800000,10800000,353,0,1.0,1
Gianni Taccon,proprio qua vicino,1,5,20164000000,20174000000,10000000,354,0,1.0,1
Amedeo Cinaglia,era un simbolo roma i lupi l hanno fondata,1,5,20177200000,20206000000,28800000,355,0,1.0,1
Gianni Taccon,ma la tenevano in gabbia,1,5,20206800000,20221200000,14400000,356,0,1.0,1
Gianni Taccon,come finucci,1,5,20226800000,20238400000,11600000,357,0,1.0,1
Gianni Taccon,sto controllando le ditte su ostia c è qualcosa di strano,1,5,20266000000,20293600000,27600000,358,0,1.0,1
Amedeo Cinaglia,prima mi ha detto che non aveva ancora visto le carte,1,5,20307200000,20330800000,23600000,359,0,1.0,1
Gianni Taccon,non posso fidarmi di nessuno,1,5,20336000000,20350800000,14800000,360,0,1.0,1
Amedeo Cinaglia,noi non siamo lupi,1,5,20390800000,20403200000,12400000,361,0,1.0,1
Gianni Taccon,no,1,5,20432000000,20441600000,9600000,362,0,1.0,1
Gianni Taccon,direi di no,1,5,20452400000,20461600000,9200000,363,0,1.0,1
Amedeo Cinaglia,ma lei cosa farebbe se oggi le offrissero,1,5,20476000000,20496399999,20399999,364,0,1.0,1
Amedeo Cinaglia,di realizzare il suo progetto sui musei di roma,1,5,20497199999,20520000000,22800001,365,0,1.0,1
Gianni Taccon,non ci crederei,1,5,20529200000,20540000000,10800000,366,0,1.0,1
Gianni Taccon,e comunque non me lo offriranno,1,5,20545600000,20560400000,14800000,367,0,1.0,1
Gianni Taccon,adesso mi scusi ma devo andare,1,5,20574400000,20590400000,16000000,368,0,1.0,1
Amedeo Cinaglia,buonanotte,1,5,20598400000,20610400000,12000000,369,0,1.0,1
Gianni Taccon,notte,1,5,20598400000,20610400000,12000000,370,0,1.0,1
Gabriele Marchilli,adesso posso sapere perché mi hai chiamato,1,5,20924000000,20944000000,20000000,371,0,1.0,1
Sara Monaschi,perché stavi là da samurai,1,5,20969600000,20986000000,16400000,372,0,0.0,1
Gabriele Marchilli,il debito ce l avevo con lui,1,5,20999600000,21014400000,14800000,373,0,1.0,1
Gabriele Marchilli,ora è tutto risolto,1,5,21027200000,21040000000,12800000,374,0,1.0,1
Sara Monaschi,tutto qua,1,5,21062800000,21071200000,8400000,375,0,0.0,1
Gabriele Marchilli,tutto qua,1,5,21080800000,21089200000,8400000,376,0,1.0,1
Gabriele Marchilli,e tu che ci facevi al maneggio,1,5,21102000000,21115600000,13600000,377,0,1.0,1
Sara Monaschi,niente d importante,1,5,21122000000,21132000000,10000000,378,0,0.0,1
Gabriele Marchilli,niente d importante con samurai,1,5,21175200000,21192400000,17200000,379,0,1.0,1
Gabriele Marchilli,sara perché siamo qua,1,5,21256000000,21270400000,14400000,380,0,1.0,1
Sara Monaschi,perché ero preoccupata per te,1,5,21277200000,21294800000,17600000,381,0,0.0,1
Sara Monaschi,io quando t ho visto lì ho avuto paura,1,5,21314000000,21339200000,25200000,382,0,0.0,1
Gabriele Marchilli,paura e di che,1,5,21370400000,21391200000,20800000,383,0,1.0,1
Sara Monaschi,non lo so,1,5,21416400000,21426000000,9600000,384,0,0.0,1
Gabriele Marchilli,ora me lo dici perché siamo qua,1,5,21479600000,21495600000,16000000,385,0,1.0,1
Livia Adami,oh,1,5,21790000000,21800400000,10400000,387,0,0.0,1
Livia Adami,dove vai,1,5,21823200000,21832000000,8800000,388,0,0.0,1
Ezio Quirino,io vado a casa a dormire dove vuoi che vado,1,5,21832800000,21853200000,20400000,389,0,1.0,1
Livia Adami,vieni qua,1,5,21872800000,21883200000,10400000,390,0,0.0,1
Ezio Quirino,che c è,1,5,21915200000,21923600000,8400000,391,0,1.0,1
Livia Adami,ti volevo ringraziare,1,5,21974800000,21986400000,11600000,392,0,0.0,1
Livia Adami,senza di te non avrei fatto niente,1,5,22012400000,22034400000,22000000,393,0,0.0,1
Ezio Quirino,hai fatto tutto da sola,1,5,22048000000,22062400000,14400000,394,0,1.0,1
Ezio Quirino,volevo solo difendere il posto di lavoro no,1,5,22097200000,22117200000,20000000,395,0,1.0,1
Vincenzo Sale,t affido la vita mia spadi,1,5,22526400000,22542800000,16400000,398,0,1.0,1
Adelaide Anacleti,adesso fai parte della famiglia,1,5,22556800000,22574400000,17600000,399,0,0.0,1
Manfredi Anacleti,mo devi fare l uomo fatti onore,1,5,22695200000,22717200000,22000000,400,0,1.0,1
Isabelle Mbamba,oh,1,5,22955200000,22973600000,18400000,402,0,0.0,1
Aureliano Adami,li ammazzo tutti,1,5,22955200000,22973600000,18400000,403,0,1.0,1
Isabelle Mbamba,ma che hai fatto che è successo,1,5,22974400000,22992000000,17600000,404,0,0.0,1
Aureliano Adami,m hanno inculato,1,5,22999600000,23010000000,10400000,405,0,1.0,1
Aureliano Adami,samurai mio padre mia sorella tutti,1,5,23014800000,23034400000,19600000,406,0,1.0,1
Isabelle Mbamba,calmati aurelia,1,5,23043600000,23052800000,9200000,407,0,0.0,1
Aureliano Adami,calmati un cazzo non ho più niente mi hanno levato tutto,1,5,23053600000,23080800000,27200000,408,1,1.0,1
Aureliano Adami,sono solo come un cane,1,5,23110000000,23122800000,12800000,409,0,1.0,1
Amedeo Cinaglia,guarda che lo so che non dormi,1,5,23705600000,23720000000,14400000,410,0,1.0,1
Alice,dove sei stato,1,5,23799600000,23812400000,12800000,411,0,0.0,1
Amedeo Cinaglia,a prenderti questi,1,5,23862400000,23874800000,12400000,412,0,1.0,1
Alice,sei uno stronzo,1,5,23896400000,23912000000,15600000,413,1,0.0,1
Amedeo Cinaglia,lo so,1,5,23929200000,23937600000,8400000,414,0,1.0,1
Alice,chi era quello che è venuto oggi,1,5,24034400000,24050000000,15600000,415,0,0.0,1
Amedeo Cinaglia,quello chi,1,5,24060000000,24070400000,10400000,416,0,1.0,1
Alice,quello di stamattina davanti al negozio,1,5,24076000000,24096400000,20400000,417,0,0.0,1
Alice,mi sembravi spaventato,1,5,24103600000,24118800000,15200000,418,0,0.0,1
Amedeo Cinaglia,ma no quello è uno che voleva un favore,1,5,24146400000,24165600000,19200000,419,0,1.0,1
Amedeo Cinaglia,stai tranquilla,1,5,24174000000,24183600000,9600000,420,0,1.0,1
Alice,io sto tranquilla amede,1,5,24191200000,24207200000,16000000,421,0,0.0,1
Alice,tu,1,5,24226800000,24236000000,9200000,422,0,0.0,1
Franco Marchilli,gabriele,1,5,24404800000,24415200000,10400000,423,0,1.0,1
Gabriele Marchilli,ohi papà,1,5,24430800000,24440400000,9600000,424,0,1.0,1
Gabriele Marchilli,ehi cambia che è sto schifo,1,5,24510800000,24531200000,20400000,427,0,1.0,1
Franco Marchilli,senti un po,1,5,24558000000,24566400000,8400000,429,0,1.0,1
Franco Marchilli,ho parlato con quell amico tuo come si chiama lucio,1,5,24572400000,24596800000,24400000,430,0,1.0,1
Franco Marchilli,quello con cui dici stai sempre a studiare,1,5,24600000000,24619200000,19200000,431,0,1.0,1
Franco Marchilli,dice che sono due settimane che non ti sente e non ti vede,1,5,24632800000,24657200000,24400000,432,0,1.0,1
Gabriele Marchilli,oh,1,5,24669600000,24678000000,8400000,433,0,1.0,1
Gabriele Marchilli,quante bugie mi hai raccontato,1,5,24685200000,24702000000,16800000,434,0,1.0,1
Gabriele Marchilli,mo basta,1,5,24716400000,24727200000,10800000,435,0,1.0,1
Gabriele Marchilli,perché poi la testa pensa e ripensa a tutte le cose strane che sono successe,1,5,24728000000,24766000000,38000000,436,0,1.0,1
Gabriele Marchilli,torni tardi la sera,1,5,24766800000,24780000000,13200000,437,0,1.0,1
Gabriele Marchilli,hai sfondato la macchina,1,5,24784000000,24798000000,14000000,438,0,1.0,1
Franco Marchilli,non serve fare la guardia con me,1,5,24798800000,24814800000,16000000,439,0,1.0,1
Gabriele Marchilli,e mi rispondi pure,1,5,24815600000,24827200000,11600000,440,0,1.0,1
Gabriele Marchilli,sai che c è di nuovo gabrie,1,5,24846000000,24859600000,13600000,441,0,1.0,1
Gabriele Marchilli,da oggi le fregnacce tue non me le bevo più,1,5,24867600000,24885600000,18000000,442,0,1.0,1
Gabriele Marchilli,da oggi sei te che decidi chi cazzo vuoi essere nella vita,1,5,24886400000,24911600000,25200000,443,1,1.0,1
Gabriele Marchilli,io non voglio più sapere niente,1,5,24915200000,24931200000,16000000,444,0,1.0,1
Franco Marchilli,appunto,1,5,24932000000,24940400000,8400000,445,0,1.0,1
Gabriele Marchilli,io ho scelto di non essere come te,1,5,24941200000,24956800000,15600000,446,0,1.0,1
Franco Marchilli,ah,1,5,24957600000,24966000000,8400000,447,0,1.0,1
Franco Marchilli,e che hai scelto,1,5,24976400000,24986400000,10000000,448,0,1.0,1
Franco Marchilli,dimmi che cazzo hai scelto,1,5,25001600000,25016800000,15200000,449,1,1.0,1
Franco Marchilli,dillo,1,5,25022400000,25034800000,12400000,450,0,1.0,1
Franco Marchilli,tie e mo se vuoi cambiare canale cambia pure,1,5,25082800000,25106000000,23200000,451,0,1.0,1
Franco Marchilli,il più grande fallimento della vita mia,1,5,25118800000,25139600000,20800000,452,0,1.0,1
Angelica Sale,non è proprio come me lo sono sognato,1,5,26346800000,26366800000,20000000,453,0,0.0,1
Alberto Anacleti,e com era,1,5,26390000000,26400800000,10800000,454,0,1.0,1
Angelica Sale,beh un po più movimentato,1,5,26429200000,26444400000,15200000,455,0,0.0,1
Alberto Anacleti,così eh,1,5,26528400000,26546400000,18000000,456,0,1.0,1
