character,script_line,episode,begin,end,duration,episode_index,bad_words,is_male
Contessa Sveva Della Rocca Croce,il mio solito tè bianco con una puntina di zenzero,5,15782400000,15813600000,31200000,273,0,0
Sara Monaschi,per me lo stesso grazie,5,15831600000,15844000000,12400000,274,0,0
Sara Monaschi,perché vuole fregare samurai,5,15870000000,15889200000,19200000,275,0,0
Contessa Sveva Della Rocca Croce,perché lui ha rovinato me e mio marito,5,15916000000,15941200000,25200000,276,0,0
Sara Monaschi,come,5,15956400000,15965200000,8800000,277,0,0
Contessa Sveva Della Rocca Croce,ricordi la famosa rapina di samurai,5,15993600000,16011600000,18000000,278,0,0
Sara Monaschi,sì,5,16022400000,16030800000,8400000,279,0,0
Contessa Sveva Della Rocca Croce,il vero obiettivo non erano i gioielli ma certi documenti,5,16042000000,16073600000,31600000,280,0,0
Contessa Sveva Della Rocca Croce,coi gioielli ti compri mezza roma ma coi segreti te la prendi tutta,5,16082800000,16119200000,36400000,281,0,0
Contessa Sveva Della Rocca Croce,e lui se l è presa,5,16120000000,16132000000,12000000,282,0,0
Contessa Sveva Della Rocca Croce,e si è preso pure le aziende di mio marito,5,16136800000,16157200000,20400000,283,0,0
Contessa Sveva Della Rocca Croce,che alla fine si è ammazzato,5,16181600000,16200400000,18800000,284,0,0
Contessa Sveva Della Rocca Croce,tieni gli occhi aperti che samurai non l abbiamo ancora fregato,5,16226800000,16256000000,29200000,285,0,0
Livia Adami,hai ragione tu,5,16324800000,16337200000,12400000,286,0,0
Livia Adami,prima aureliano,5,16342400000,16352800000,10400000,287,0,0
Livia Adami,e poi gli zingari di merda,5,16359600000,16376800000,17200000,288,1,0
Livia Adami,una guerra alla volta,5,16388800000,16399600000,10800000,289,0,0
Livia Adami,aureliano si è preso i soldi che stavano in mezzo alle dune,5,16426800000,16454000000,27200000,291,0,0
Livia Adami,ma degli affari miei non sa un cazzo,5,16454800000,16472400000,17600000,292,1,0
Livia Adami,mi devi portare tutti i conti della famiglia,5,16482000000,16502400000,20400000,293,0,0
Livia Adami,devo sapere fino a che punto mi posso spingere,5,16511600000,16534000000,22400000,294,0,0
Livia Adami,prima voglio parlare con le famiglie di ostia che lavorano per noi,5,16573600000,16602800000,29200000,296,0,0
Livia Adami,mi devono appoggiare,5,16613600000,16625200000,11600000,297,0,0
Livia Adami,che vuoi in cambio del tuo appoggio,5,16924800000,16944800000,20000000,300,0,0
Samurai Valerio,appoggio è una parola brutta la usano i politici,5,16961600000,16986000000,24400000,301,0,1
Samurai Valerio,diciamo che io ti aiuto a salire sul trono che ti spetta,5,16991200000,17019200000,28000000,302,0,1
Livia Adami,e in cambio,5,17037200000,17048800000,11600000,303,0,0
Samurai Valerio,niente più sangue,5,17051600000,17064800000,13200000,304,0,1
Samurai Valerio,nessuna vendetta sugli zingari,5,17065600000,17086000000,20400000,305,0,1
Samurai Valerio,oltre a quello che mi aveva promesso tuo padre su ostia,5,17093200000,17119200000,26000000,306,0,1
Livia Adami,guarda che il trono di papà non è un seggiolone,5,17150800000,17173200000,22400000,307,0,0
Livia Adami,e io non sono più una ragazzina,5,17178400000,17194800000,16400000,308,0,0
Samurai Valerio,che vuoi dire,5,17205600000,17217200000,11600000,309,0,1
Livia Adami,che sul trono di mio padre mi ci siedo da sola non ho bisogno dell aiuto tuo,5,17221200000,17254800000,33600000,310,0,0
Samurai Valerio,e che saresti venuta a fare,5,17262000000,17278000000,16000000,311,0,1
Livia Adami,a dirti che mio padre non lo vendico proprio come vuoi tu,5,17304800000,17332000000,27200000,312,0,0
Livia Adami,ma in cambio voglio l 8 sull affare di ostia,5,17349600000,17374000000,24400000,313,0,0
Manfredi Anacleti,fai scendere gli sposi,5,17636000000,17654000000,18000000,319,0,1
Manfredi Anacleti,maestro,5,17772800000,17786000000,13200000,323,0,1
Manfredi Anacleti,maestro facciamo un lento per favore,5,17786800000,17823600000,36800000,324,0,1
Manfredi Anacleti,mio fratello è un uomo fortunato,5,18127200000,18142400000,15200000,329,0,1
Manfredi Anacleti,viva gli sposi,5,18278400000,18299200000,20800000,330,0,1
Manfredi Anacleti,vai spadi,5,18332000000,18344800000,12800000,332,0,1
Aureliano Adami,che cazzo è tutta sta gente,5,18977200000,18993600000,16400000,336,1,1
Aureliano Adami,mo sì che ti riconosco sorellina,5,19405200000,19426800000,21600000,338,0,1
Aureliano Adami,che schifo mi fai,5,19518000000,19534000000,16000000,339,0,1
Amedeo Cinaglia,buonasera,5,19786800000,19802800000,16000000,341,0,1
Amedeo Cinaglia,volevo solo capire quando potevamo vederci per coordinare i lavori,5,19849600000,19881600000,32000000,343,0,1
Amedeo Cinaglia,che fine ha fatto quel suo progetto sui musei di roma,5,19928400000,19953600000,25200000,346,0,1
Amedeo Cinaglia,me lo ricordo bene,5,20018800000,20029600000,10800000,349,0,1
Amedeo Cinaglia,era un bel progetto,5,20034400000,20044000000,9600000,350,0,1
Amedeo Cinaglia,ci pensa mai,5,20060400000,20070400000,10000000,351,0,1
Amedeo Cinaglia,era un simbolo roma i lupi l hanno fondata,5,20177200000,20206000000,28800000,355,0,1
Amedeo Cinaglia,prima mi ha detto che non aveva ancora visto le carte,5,20307200000,20330800000,23600000,359,0,1
Amedeo Cinaglia,noi non siamo lupi,5,20390800000,20403200000,12400000,361,0,1
Amedeo Cinaglia,ma lei cosa farebbe se oggi le offrissero,5,20476000000,20496399999,20399999,364,0,1
Amedeo Cinaglia,di realizzare il suo progetto sui musei di roma,5,20497199999,20520000000,22800001,365,0,1
Amedeo Cinaglia,buonanotte,5,20598400000,20610400000,12000000,369,0,1
Gabriele Marchilli,adesso posso sapere perché mi hai chiamato,5,20924000000,20944000000,20000000,371,0,1
Sara Monaschi,perché stavi là da samurai,5,20969600000,20986000000,16400000,372,0,0
Gabriele Marchilli,il debito ce l avevo con lui,5,20999600000,21014400000,14800000,373,0,1
Gabriele Marchilli,ora è tutto risolto,5,21027200000,21040000000,12800000,374,0,1
Sara Monaschi,tutto qua,5,21062800000,21071200000,8400000,375,0,0
Gabriele Marchilli,tutto qua,5,21080800000,21089200000,8400000,376,0,1
Gabriele Marchilli,e tu che ci facevi al maneggio,5,21102000000,21115600000,13600000,377,0,1
Sara Monaschi,niente d importante,5,21122000000,21132000000,10000000,378,0,0
Gabriele Marchilli,niente d importante con samurai,5,21175200000,21192400000,17200000,379,0,1
Gabriele Marchilli,sara perché siamo qua,5,21256000000,21270400000,14400000,380,0,1
Sara Monaschi,perché ero preoccupata per te,5,21277200000,21294800000,17600000,381,0,0
Sara Monaschi,io quando t ho visto lì ho avuto paura,5,21314000000,21339200000,25200000,382,0,0
Gabriele Marchilli,paura e di che,5,21370400000,21391200000,20800000,383,0,1
Sara Monaschi,non lo so,5,21416400000,21426000000,9600000,384,0,0
Gabriele Marchilli,ora me lo dici perché siamo qua,5,21479600000,21495600000,16000000,385,0,1
Livia Adami,oh,5,21790000000,21800400000,10400000,387,0,0
Livia Adami,dove vai,5,21823200000,21832000000,8800000,388,0,0
Livia Adami,vieni qua,5,21872800000,21883200000,10400000,390,0,0
Livia Adami,ti volevo ringraziare,5,21974800000,21986400000,11600000,392,0,0
Livia Adami,senza di te non avrei fatto niente,5,22012400000,22034400000,22000000,393,0,0
Manfredi Anacleti,mo devi fare l uomo fatti onore,5,22695200000,22717200000,22000000,400,0,1
Aureliano Adami,li ammazzo tutti,5,22955200000,22973600000,18400000,403,0,1
Aureliano Adami,m hanno inculato,5,22999600000,23010000000,10400000,405,0,1
Aureliano Adami,samurai mio padre mia sorella tutti,5,23014800000,23034400000,19600000,406,0,1
Aureliano Adami,calmati un cazzo non ho più niente mi hanno levato tutto,5,23053600000,23080800000,27200000,408,1,1
Aureliano Adami,sono solo come un cane,5,23110000000,23122800000,12800000,409,0,1
Amedeo Cinaglia,guarda che lo so che non dormi,5,23705600000,23720000000,14400000,410,0,1
Amedeo Cinaglia,a prenderti questi,5,23862400000,23874800000,12400000,412,0,1
Amedeo Cinaglia,lo so,5,23929200000,23937600000,8400000,414,0,1
Amedeo Cinaglia,quello chi,5,24060000000,24070400000,10400000,416,0,1
Amedeo Cinaglia,ma no quello è uno che voleva un favore,5,24146400000,24165600000,19200000,419,0,1
Amedeo Cinaglia,stai tranquilla,5,24174000000,24183600000,9600000,420,0,1
Gabriele Marchilli,ohi papà,5,24430800000,24440400000,9600000,424,0,1
Gabriele Marchilli,ehi cambia che è sto schifo,5,24510800000,24531200000,20400000,427,0,1
Gabriele Marchilli,oh,5,24669600000,24678000000,8400000,433,0,1
Gabriele Marchilli,quante bugie mi hai raccontato,5,24685200000,24702000000,16800000,434,0,1
Gabriele Marchilli,mo basta,5,24716400000,24727200000,10800000,435,0,1
Gabriele Marchilli,perché poi la testa pensa e ripensa a tutte le cose strane che sono successe,5,24728000000,24766000000,38000000,436,0,1
Gabriele Marchilli,torni tardi la sera,5,24766800000,24780000000,13200000,437,0,1
Gabriele Marchilli,hai sfondato la macchina,5,24784000000,24798000000,14000000,438,0,1
Gabriele Marchilli,e mi rispondi pure,5,24815600000,24827200000,11600000,440,0,1
Gabriele Marchilli,sai che c è di nuovo gabrie,5,24846000000,24859600000,13600000,441,0,1
Gabriele Marchilli,da oggi le fregnacce tue non me le bevo più,5,24867600000,24885600000,18000000,442,0,1
Gabriele Marchilli,da oggi sei te che decidi chi cazzo vuoi essere nella vita,5,24886400000,24911600000,25200000,443,1,1
Gabriele Marchilli,io non voglio più sapere niente,5,24915200000,24931200000,16000000,444,0,1
Gabriele Marchilli,io ho scelto di non essere come te,5,24941200000,24956800000,15600000,446,0,1
Angelica Sale,non è proprio come me lo sono sognato,5,26346800000,26366800000,20000000,453,0,0
Alberto Anacleti,e com era,5,26390000000,26400800000,10800000,454,0,1
Angelica Sale,beh un po più movimentato,5,26429200000,26444400000,15200000,455,0,0
Alberto Anacleti,così eh,5,26528400000,26546400000,18000000,456,0,1
Alberto Anacleti,così eh,5,26611200000,26629600000,18400000,457,0,1
Alberto Anacleti,così,5,26655200000,26668000000,12800000,458,0,1
Alberto Anacleti,così,5,26679200000,26692000000,12800000,460,0,1
Angelica Sale,ma che succede,5,26836000000,26850400000,14400000,462,0,0
Angelica Sale,oh,5,26882000000,26890400000,8400000,463,0,0
Angelica Sale,almeno mi guardi,5,26903200000,26917200000,14000000,464,0,0
Angelica Sale,che cazzo stai a fare,5,26966400000,26983200000,16800000,465,1,0
Angelica Sale,albe non fare cazzate eh,5,26984000000,26998000000,14000000,466,1,0
Angelica Sale,oh,5,27004400000,27013600000,9200000,467,0,0
Alberto Anacleti,non lo deve sapere nessuno,5,27310000000,27325200000,15200000,469,0,1
Alberto Anacleti,intesi,5,27336000000,27346400000,10400000,470,0,1
Samurai Valerio,allora taccon è nostro,5,27517600000,27533600000,16000000,471,0,1
Amedeo Cinaglia,so come gestirlo,5,27540000000,27553600000,13600000,472,0,1
Samurai Valerio,bene bravo,5,27554400000,27572400000,18000000,473,0,1
Amedeo Cinaglia,forse però c è un problema,5,27586000000,27600400000,14400000,474,0,1
Samurai Valerio,sentiamo,5,27604000000,27614400000,10400000,475,0,1
Amedeo Cinaglia,vuole bloccare tutto,5,27622000000,27634800000,12800000,476,0,1
Amedeo Cinaglia,dice che c è qualcosa di poco chiaro dietro le ditte,5,27644400000,27669200000,24800000,477,0,1
Amedeo Cinaglia,io so cosa scoprirà,5,27689600000,27703600000,14000000,478,0,1
Samurai Valerio,e che deve scoprire sto stronzo,5,27709200000,27726400000,17200000,479,1,1
Amedeo Cinaglia,che dietro c è la mafia,5,27739200000,27752400000,13200000,480,0,1
Amedeo Cinaglia,a taccon ci penso io,5,27805200000,27819600000,14400000,481,0,1
Amedeo Cinaglia,però voglio rivedere i patti,5,27837600000,27852400000,14800000,482,0,1
Samurai Valerio,non hai fatto ancora un cazzo cina,5,27873200000,27892000000,18800000,483,1,1
Samurai Valerio,e lo decido io cosa è giusto e cosa no,5,27899600000,27921200000,21600000,484,0,1
Manfredi Anacleti,no,5,28215200000,28225200000,10000000,485,0,1
Manfredi Anacleti,oggi no solo per oggi devi servire per primo tuo marito,5,28230800000,28258800000,28000000,486,0,1
Manfredi Anacleti,stanotte t ha fatto femmina e va a lui pure quest altro onore,5,28272800000,28299200000,26400000,487,0,1
Gabriele Marchilli,cazzo,5,29005200000,29015600000,10400000,491,1,1
Aureliano Adami,pare che mi sta fissando pure da là dentro,5,29579200000,29600800000,21600000,492,0,1
Aureliano Adami,mi vorrebbe fare la predica come al solito,5,29617200000,29636800000,19600000,493,0,1
Livia Adami,stavolta la farebbe a tutti e due,5,29650800000,29669600000,18800000,494,0,0
Aureliano Adami,no,5,29705600000,29714000000,8400000,495,0,1
Aureliano Adami,sarebbe contento,5,29738400000,29751600000,13200000,496,0,1
Livia Adami,perché è giusto così,5,29792000000,29806800000,14800000,497,0,0
Aureliano Adami,è giusto per te,5,29834400000,29848800000,14400000,498,0,1
Livia Adami,posto per te in famiglia ci sta e ci starà sempre aurelia,5,29903600000,29932800000,29200000,499,0,0
Aureliano Adami,pure per te il posto in famiglia ci sarà sempre,5,30018400000,30042000000,23600000,500,0,1
Gabriele Marchilli,t ha chiamato pure a te,5,31157200000,31168400000,11200000,502,0,1
Alberto Anacleti,sai che vuole,5,31184400000,31194400000,10000000,503,0,1
Gabriele Marchilli,no,5,31219600000,31228000000,8400000,504,0,1
Aureliano Adami,tocca che torniamo insieme,5,31916400000,31932400000,16000000,506,0,1
Alberto Anacleti,cioè,5,31984400000,31994000000,9600000,507,0,1
Aureliano Adami,cioè ripartiamo da zio prete,5,31994800000,32012400000,17600000,508,0,1
Aureliano Adami,ma stavolta non gli leviamo i soldi gli leviamo i terreni,5,32029600000,32056000000,26400000,509,0,1
Alberto Anacleti,mmh,5,32073600000,32082000000,8400000,510,0,1
Alberto Anacleti,e per farci che,5,32086800000,32095200000,8400000,511,0,1
Aureliano Adami,per sputare in faccia a un po di gente spadi,5,32099600000,32121600000,22000000,512,0,1
Aureliano Adami,a samurai per primo,5,32131200000,32144000000,12800000,513,0,1
Aureliano Adami,poi io a mia sorella,5,32161600000,32176400000,14800000,514,0,1
Aureliano Adami,te a quella merda di tuo fratello,5,32181200000,32198400000,17200000,515,1,1
Aureliano Adami,e te che cazzo ne so ci sarà qualcuno a cui vuoi sputare in faccia,5,32203200000,32230800000,27600000,516,1,1
Aureliano Adami,chiudiamo con le famiglie e ci riprendiamo la vita nostra,5,32259600000,32282000000,22400000,517,0,1
Gabriele Marchilli,ma che cazzo stai a dire,5,32312800000,32322800000,10000000,518,1,1
Aureliano Adami,sto posto è della famiglia mia tutto intorno è del prete,5,32349600000,32374000000,24400000,519,0,1
Aureliano Adami,noi ci prendiamo tutto diventa tutta roba nostra,5,32374800000,32396400000,21600000,520,0,1
Aureliano Adami,ma stavolta non si gioca,5,32420800000,32434400000,13600000,521,0,1
Aureliano Adami,ci verranno sotto tutti politici preti e pure quella faccia di merda di samurai,5,32450000000,32484000000,34000000,522,1,1
Aureliano Adami,ci state,5,32550000000,32558400000,8400000,523,0,1
Aureliano Adami,sì o no,5,32643600000,32652800000,9200000,524,0,1
Alberto Anacleti,dai,5,32733600000,32742800000,9200000,525,0,1
Gabriele Marchilli,dai,5,32822400000,32833200000,10800000,526,0,1
Aureliano Adami,dai,5,32867600000,32876800000,9200000,527,0,1
Sara Monaschi,monsignore,6,642800000,651200000,8400000,1,0,0
Sara Monaschi,ma adesso sono io che prego lei venga via venga qua,6,682800000,711600000,28800000,3,0,0
Sara Monaschi,venga qui da me,6,722000000,732800000,10800000,4,0,0
Sara Monaschi,la prego,6,736400000,745600000,9200000,5,0,0
Sara Monaschi,non c è niente a cui non si possa porre rimedio,6,771200000,793600000,22400000,6,0,0
Sara Monaschi,il signore perdona,6,801600000,815600000,14000000,7,0,0
Sara Monaschi,gli uomini perdonano,6,831200000,845600000,14400000,8,0,0
Sara Monaschi,mi fermo,6,1038800000,1049200000,10400000,13,0,0
Sara Monaschi,ma lei resti lì dov è,6,1066000000,1079600000,13600000,14,0,0
Sara Monaschi,adesso noi torniamo a roma,6,1109600000,1123600000,14000000,15,0,0
Sara Monaschi,la chiesa l aiuterà a sparire,6,1145600000,1164000000,18400000,17,0,0
Sara Monaschi,a ritirarsi,6,1167600000,1180800000,13200000,18,0,0
Sara Monaschi,lei non esisterà più per nessuno,6,1190800000,1206000000,15200000,19,0,0
Sara Monaschi,ripenserà a questo momento e magari starà dicendo messa,6,1230400000,1259600000,29200000,20,0,0
Sara Monaschi,in qualche posto sperduto,6,1260400000,1276400000,16000000,21,0,0
Sara Monaschi,in una chiesetta di campagna,6,1288400000,1300800000,12400000,22,0,0
Sara Monaschi,e studierà pregherà,6,1324400000,1342400000,18000000,23,0,0
Sara Monaschi,una nuova vita,6,1412000000,1425600000,13600000,24,0,0
Sara Monaschi,lontano da tutto,6,1440000000,1450400000,10400000,25,0,0
Sara Monaschi,puoi tornare a casa tua in grecia,6,1492400000,1509200000,16800000,26,0,0
Sara Monaschi,dammi la mano ti prego,6,1513600000,1531200000,17600000,27,0,0
Sara Monaschi,dammi la mano,6,1540800000,1550000000,9200000,28,0,0
Sara Monaschi,vieni,6,1555200000,1563600000,8400000,29,0,0
Sara Monaschi,vieni,6,1572000000,1580800000,8800000,30,0,0
Sara Monaschi,dai,6,1590000000,1598400000,8400000,31,0,0
Sara Monaschi,dammi la mano,6,1602000000,1613200000,11200000,32,0,0
Sara Monaschi,ehi,6,2068000000,2079200000,11200000,33,0,0
Gabriele Marchilli,ciao,6,2068000000,2079200000,11200000,34,0,1
Sara Monaschi,allora è vero che non puoi vivere senza di me,6,2091600000,2114400000,22800000,35,0,0
Sara Monaschi,che è successo,6,2142800000,2153200000,10400000,36,0,0
Gabriele Marchilli,niente perché,6,2159200000,2174400000,15200000,37,0,1
Sara Monaschi,hai una faccia,6,2184800000,2197200000,12400000,38,0,0
Gabriele Marchilli,ho dormito poco,6,2201600000,2212400000,10800000,39,0,1
Sara Monaschi,allora dove mi porti,6,2236000000,2254400000,18400000,41,0,0
Gabriele Marchilli,è una sorpresa,6,2257200000,2267600000,10400000,42,0,1
Manfredi Anacleti,spadino,6,2421600000,2431200000,9600000,44,0,1
Angelica Sale,dev essere uscito presto,6,2450800000,2462800000,12000000,45,0,0
Manfredi Anacleti,per andare dove,6,2465600000,2484000000,18400000,46,0,1
Angelica Sale,non lo so,6,2465600000,2484000000,18400000,47,0,0
Manfredi Anacleti,non lo sai,6,2487600000,2496400000,8800000,48,0,1
Manfredi Anacleti,una moglie deve sempre sapere dove sta il marito,6,2497200000,2518000000,20800000,49,0,1
Manfredi Anacleti,e lo deve fare contento,6,2536800000,2548800000,12000000,50,0,1
Manfredi Anacleti,vieni qua,6,2560400000,2569200000,8800000,51,0,1
Manfredi Anacleti,vieni qua mica ti mordo vieni,6,2578399999,2596400000,18000001,52,0,1
Manfredi Anacleti,avvicinati,6,2611200000,2619599999,8399999,53,0,1
Manfredi Anacleti,tieni,6,2682800000,2691200000,8400000,54,0,1
Manfredi Anacleti,dai prendili comprati qualcosa di carino,6,2697200000,2716000000,18800000,55,0,1
Manfredi Anacleti,la mercanzia ce l hai mettila in mostra no,6,2778800000,2798000000,19200000,56,0,1
Sara Monaschi,beh sarebbe questa la sorpresa,6,2978800000,2998400000,19600000,58,0,0
Aureliano Adami,no,6,2999200000,3008400000,9200000,59,0,1
Aureliano Adami,siamo noi la sorpresa,6,3024400000,3037600000,13200000,60,0,1
Gabriele Marchilli,tranquilla adesso ti spiego tutto,6,3090000000,3109600000,19600000,61,0,1
Sara Monaschi,che mi devi spiegare,6,3117600000,3130400000,12800000,62,0,0
Sara Monaschi,che sei un pezzo di merda,6,3131200000,3146000000,14800000,63,1,0
Sara Monaschi,eh eri d accordo con questi due fin dall inizio,6,3151200000,3176400000,25200000,64,0,0
Sara Monaschi,stronzo,6,3180400000,3192400000,12000000,65,1,0
Gabriele Marchilli,sara,6,3180400000,3192400000,12000000,66,0,1
Sara Monaschi,stronzo,6,3193200000,3203200000,10000000,67,1,0
Alberto Anacleti,ammazza che sberla,6,3204000000,3225200000,21200000,68,0,1
Sara Monaschi,andatevene affanculo perché io non ho niente da dirvi,6,3230400000,3254400000,24000000,69,1,0
Aureliano Adami,invece mi sa di sì,6,3255200000,3267600000,12400000,70,0,1
Gabriele Marchilli,oh che cazzo fai,6,3272400000,3289600000,17200000,71,1,1
Aureliano Adami,statti zitto,6,3272400000,3289600000,17200000,72,0,1
Aureliano Adami,che dobbiamo fare,6,3310000000,3319600000,9600000,73,0,1
Aureliano Adami,pensaci bene,6,3418800000,3430000000,11200000,74,0,1
Aureliano Adami,a dove sta sto prete che magari ti torna in mente,6,3436000000,3458400000,22400000,75,0,1
Sara Monaschi,ti ho detto che non lo so,6,3473200000,3486400000,13200000,76,0,0
Alberto Anacleti,ma ti conviene proteggere quel bagarozzo di merda,6,3498800000,3531600000,32800000,77,1,1
Sara Monaschi,e poi che volete da lui scusa,6,3541200000,3555200000,14000000,78,0,0
Aureliano Adami,i terreni di ostia,6,3569200000,3580400000,11200000,79,0,1
Sara Monaschi,che cosa,6,3598000000,3606400000,8400000,80,0,0
Aureliano Adami,ma che parlo un altra lingua io,6,3619600000,3634800000,15200000,81,0,1
Alberto Anacleti,ha capito,6,3635600000,3652000000,16400000,82,0,1
Alberto Anacleti,devi convincere la commissione a non rompere i coglioni,6,3652800000,3680400000,27600000,83,1,1
Sara Monaschi,i terreni di ostia,6,3684000000,3696800000,12800000,84,0,0
Sara Monaschi,ma che è uno scherzo,6,3705200000,3718000000,12800000,85,0,0
Sara Monaschi,la commissione non assegnerà mai quei terreni a voi tre,6,3731600000,3757200000,25600000,86,0,0
Sara Monaschi,è impossibile,6,3762000000,3770800000,8800000,87,0,0
Aureliano Adami,e perché,6,3771600000,3780800000,9200000,88,0,1
Aureliano Adami,è di preti e di chiesa che parliamo,6,3795600000,3812400000,16800000,89,0,1
Aureliano Adami,quelli è una vita che fanno come cazzo gli pare,6,3813200000,3833200000,20000000,90,1,1
Sara Monaschi,siete pazzi,6,3838400000,3849600000,11200000,91,0,0
Aureliano Adami,però quei terreni o ce li prendiamo noi o non se li prende nessuno,6,3866800000,3894000000,27200000,92,0,1
Aureliano Adami,quindi dimmi dove sta sto prete forza,6,3914000000,3931200000,17200000,93,0,1
Aureliano Adami,senti mo m hai rotto il cazzo vieni qua,6,3983600000,4003600000,20000000,94,1,1
Aureliano Adami,se non mi dici dove sta questo,6,4018000000,4030800000,12800000,95,0,1
Aureliano Adami,io ti sparo in faccia ti butto nel fiume e non ti trovano più,6,4031600000,4056800000,25200000,96,0,1
Sara Monaschi,e poi come fai,6,4072400000,4082000000,9600000,97,0,0
Sara Monaschi,io conosco il vaticano,6,4097600000,4111600000,14000000,98,0,0
Sara Monaschi,io so come ragionano so come muovermi là dentro,6,4117600000,4144800000,27200000,99,0,0
Sara Monaschi,vi posso pure far entrare in quest affare ma ho bisogno di tempo,6,4153200000,4182000000,28800000,100,0,0
Sara Monaschi,per capire come per trovare una soluzione,6,4182800000,4216400000,33600000,101,0,0
Sara Monaschi,ahi,6,4217200000,4229600000,12400000,102,0,0
Aureliano Adami,hai un sacco di tempo,6,4217200000,4229600000,12400000,103,0,1
Gabriele Marchilli,forse dovremmo fare come dice lei no,6,4230400000,4246800000,16400000,104,0,1
Gabriele Marchilli,ha ragione lei conosce quelle persone,6,4254400000,4274000000,19600000,105,0,1
Gabriele Marchilli,e poi che abbiamo da perdere,6,4293200000,4308000000,14800000,106,0,1
Gabriele Marchilli,magari trova una soluzione che fa contenti a tutti,6,4315200000,4338800000,23600000,107,0,1
Gabriele Marchilli,a riprenderla facciamo sempre in tempo,6,4357600000,4376400000,18800000,108,0,1
Aureliano Adami,se fa una cazzata me la prendo con te,6,4435200000,4452000000,16800000,109,1,1
Sara Monaschi,tu vedi di sbrigarti,6,4488800000,4502800000,14000000,110,0,0
Alberto Anacleti,buh,6,4556800000,4566000000,9200000,111,0,1
Amedeo Cinaglia,ciao ste posso,6,5188800000,5204000000,15200000,114,0,1
Amedeo Cinaglia,come stai,6,5266400000,5276000000,9600000,116,0,1
Amedeo Cinaglia,ti trovo invecchiato,6,5287600000,5296800000,9200000,117,0,1
Amedeo Cinaglia,no sono invecchiato anche io invece,6,5329200000,5348400000,19200000,119,0,1
Amedeo Cinaglia,ti faccio compagnia,6,5349200000,5377600000,28400000,121,0,1
Amedeo Cinaglia,e quella volta che hai pranzato con ferinelli,6,5413600000,5432800000,19200000,123,0,1
Amedeo Cinaglia,io penso di sì invece,6,5470800000,5484400000,13600000,125,0,1
Amedeo Cinaglia,ti ricordi di quello strano pranzo che hai organizzato tanti anni fa,6,5500000000,5529600000,29600000,126,0,1
Amedeo Cinaglia,con quel lobbista molto particolare un grande sostenitore dell eolico,6,5532400000,5564400000,32000000,127,0,1
Amedeo Cinaglia,se ne parlò tanto all epoca,6,5577200000,5591200000,14000000,128,0,1
Amedeo Cinaglia,poi però finì tutto nel dimenticatoio anche le foto tue e di lui,6,5601200000,5630400000,29200000,129,0,1
Amedeo Cinaglia,poco dopo però le pale iniziarono a girare in mezza italia,6,5636800000,5667600000,30800000,130,0,1
Amedeo Cinaglia,tu lo sai come si dice no,6,5670400000,5682400000,12000000,131,0,1
Amedeo Cinaglia,a pensare male si fa peccato ma molto spesso ci si azzecca,6,5688400000,5716400000,28000000,132,0,1
Amedeo Cinaglia,no,6,5754800000,5763200000,8400000,134,0,1
Amedeo Cinaglia,voglio che usi tutto il potere che hai conquistato in questi anni,6,5768800000,5795600000,26800000,135,0,1
Amedeo Cinaglia,per affidare la direzione dei musei di roma a un amico comune,6,5796400000,5822800000,26400000,136,0,1
Amedeo Cinaglia,ma come non sei curioso di sapere chi è l amico,6,5858400000,5880000000,21600000,138,0,1
Amedeo Cinaglia,è taccon,6,5894800000,5903600000,8800000,139,0,1
Amedeo Cinaglia,il povero taccon ha sempre desiderato quel posto,6,5918400000,5939200000,20800000,140,0,1
Amedeo Cinaglia,solo che il partito aveva altri piani altri raccomandati,6,5940000000,5970800000,30800000,141,0,1
Amedeo Cinaglia,il diavolo ha pure la tua,6,6007600000,6020400000,12800000,143,0,1
Amedeo Cinaglia,quanto t hanno dato per far girare quelle pale eh,6,6021200000,6048000000,26800000,144,0,1
Amedeo Cinaglia,mi ha fatto piacere rivederti stefano,6,6146000000,6171200000,25200000,148,0,1
Amedeo Cinaglia,meglio dell ultima volta che ci siamo visti no,6,6172000000,6193200000,21200000,150,0,1
Amedeo Cinaglia,t ho spaccato la faccia,6,6198400000,6212800000,14400000,151,0,1
