character,script_line,episode,begin,end,duration,episode_index,bad_words,is_male
Aureliano Adami,chi è stato,7,20469200000,20479600000,10400000,442,0,1
Sara Monaschi,ti ha cacciato di casa,7,20541200000,20555200000,14000000,444,0,0
Gabriele Marchilli,sì,7,20573200000,20581599999,8399999,445,0,1
Sara Monaschi,ma dai sarà un cazzata una lite tra padre e figlio,7,20592800001,20626000000,33199999,446,1,0
Gabriele Marchilli,no non è una cazzata,7,20640800000,20651200000,10400000,447,1,1
Sara Monaschi,ma lui ha capito quello che stai facendo,7,20664400000,20681200000,16800000,448,0,0
Gabriele Marchilli,no non sa niente,7,20686000000,20697600000,11600000,449,0,1
Sara Monaschi,allora che cosa è successo,7,20711200000,20724000000,12800000,450,0,0
Gabriele Marchilli,lascia stare non mi va di parlarne,7,20755600000,20776799999,21199999,451,0,1
Sara Monaschi,e perché mi hai chiamato se non ti va di parlarne,7,20777600000,20800000000,22400000,452,0,0
Gabriele Marchilli,perché avevo voglia di stare con te,7,20844000000,20861999999,17999999,453,0,1
Gabriele Marchilli,e ho bisogno di un posto dove andare,7,20887600000,20905200000,17600000,454,0,1
Sara Monaschi,hai fatto una cosa bella per me oggi,7,20989600000,21006800000,17200000,455,0,0
Sara Monaschi,grazie,7,21038000000,21050000000,12000000,456,0,0
Manfredi Anacleti,ma dove vai tutto il giorno invece di lavorare,7,21129200000,21151600000,22400000,457,0,1
Manfredi Anacleti,eh,7,21158400000,21166800000,8400000,458,0,1
Manfredi Anacleti,spadi io ti sto facendo crescere per farti diventare un capo,7,21176000000,21208800000,32800000,459,0,1
Manfredi Anacleti,ma gli uomini vedono sempre che non fai un cazzo,7,21209600000,21238400000,28800000,460,1,1
Manfredi Anacleti,sai questi che diranno spadino chi,7,21273200000,21298800000,25600000,461,0,1
Manfredi Anacleti,chi è spadino,7,21305200000,21316000000,10800000,462,0,1
Manfredi Anacleti,ci stiamo allargando,7,21329200000,21344800000,15600000,463,0,1
Manfredi Anacleti,i sale sono importanti,7,21347600000,21363200000,15600000,464,0,1
Manfredi Anacleti,il matrimonio era la prima cosa che facevamo insieme,7,21369600000,21394800000,25200000,465,0,1
Manfredi Anacleti,e tu sei partito subito col piede sbagliato,7,21395600000,21416400000,20800000,466,0,1
Manfredi Anacleti,eh che devono dire di noi,7,21417200000,21437200000,20000000,467,0,1
Manfredi Anacleti,ma allora si può sapere dove cazzo vai tutto il giorno,7,21454800000,21487200000,32400000,468,1,1
Manfredi Anacleti,prendimi quel tubo,7,21508000000,21518800000,10800000,469,0,1
Manfredi Anacleti,ahó prendimi quel tubo,7,21528400000,21544800000,16400000,470,0,1
Manfredi Anacleti,non si può sapere dove vai,7,21573200000,21606000000,32800000,471,0,1
Manfredi Anacleti,spadi io ti voglio bene ma non mi devi fare incazzare,7,21606800000,21634800000,28000000,472,1,1
Manfredi Anacleti,io ti ammazzo quando mi pare,7,21645200000,21659200000,14000000,474,0,1
Angelica Sale,avete litigato un altra volta,7,22156000000,22171600000,15600000,478,0,0
Alberto Anacleti,dammi quella felpa,7,22177600000,22191200000,13600000,479,0,1
Alberto Anacleti,dai,7,22218400000,22227600000,9200000,480,0,1
Manfredi Anacleti,c è da fare una consegna,7,22309200000,22320400000,11200000,481,0,1
Manfredi Anacleti,tocca cominciare a far muovere quel bar se no credono che abbiamo scherzato,7,22321200000,22358000000,36800000,482,0,1
Manfredi Anacleti,ci vai te,7,22364400000,22373600000,9200000,483,0,1
Manfredi Anacleti,non ho capito,7,22397600000,22408000000,10400000,484,0,1
Alberto Anacleti,sì ci vado io,7,22426400000,22443600000,17200000,485,0,1
Alberto Anacleti,ordina e ordina che cazzo si ordina,7,22554400000,22578000000,23600000,487,1,1
Angelica Sale,è perché si fida di te,7,22596400000,22609600000,13200000,488,0,0
Alberto Anacleti,sì,7,22610400000,22624000000,13600000,489,0,1
Contessa Sveva Della Rocca Croce,allora,7,22829600000,22838000000,8400000,490,0,0
Sara Monaschi,è andato tutto bene,7,22851200000,22872000000,20800000,491,0,0
Contessa Sveva Della Rocca Croce,brava,7,22851200000,22872000000,20800000,492,0,0
Contessa Sveva Della Rocca Croce,lo sapevo,7,22890400000,22900000000,9600000,493,0,0
Contessa Sveva Della Rocca Croce,la prima volta che ti ho visto mi è sembrato di rivedere me stessa,7,22910000000,22941200000,31200000,494,0,0
Contessa Sveva Della Rocca Croce,ho capito che tu mi avresti dato la rivincita che cercavo,7,22942000000,22970400000,28400000,495,0,0
Contessa Sveva Della Rocca Croce,raccontami tutto,7,22987600000,23000000000,12400000,496,0,0
Samurai Valerio,sì,7,23096800000,23105200000,8400000,498,0,1
Samurai Valerio,ho capito,7,23164800000,23176000000,11200000,499,0,1
Samurai Valerio,sara monaschi si è presa i terreni di ostia,7,23193600000,23217200000,23600000,500,0,1
Samurai Valerio,quelli dei preti,7,23221200000,23231600000,10400000,501,0,1
Aureliano Adami,alzati in piedi,7,23382000000,23391200000,9200000,503,0,1
Aureliano Adami,che pezzo di merda,7,23419200000,23433600000,14400000,504,1,1
Manfredi Anacleti,spadino ha fatto quello che doveva fare,7,24084800000,24102000000,17200000,508,0,1
Angelica Sale,sì,7,24112000000,24120400000,8400000,509,0,0
Manfredi Anacleti,colpisci,7,24142400000,24156800000,14400000,510,0,1
Manfredi Anacleti,ammazzalo,7,24162000000,24177600000,15600000,511,0,1
Amedeo Cinaglia,buonasera,7,24285600000,24294000000,8400000,513,0,1
Amedeo Cinaglia,bravo taccon,7,24369200000,24380000000,10800000,516,0,1
Amedeo Cinaglia,ha fatto la scelta giusta,7,24391600000,24405600000,14000000,517,0,1
Amedeo Cinaglia,approvi in commissione,7,24411600000,24424800000,13200000,518,0,1
Amedeo Cinaglia,e avrà i musei,7,24435200000,24446000000,10800000,519,0,1
Amedeo Cinaglia,buonanotte,7,24464000000,24473600000,9600000,520,0,1
Angelica Sale,ah,7,24864400000,24876000000,11600000,522,0,0
Alberto Anacleti,allora è fatta è andata,7,25313200000,25330400000,17200000,528,0,1
Aureliano Adami,mo che si fa,7,25331200000,25342400000,11200000,529,0,1
Sara Monaschi,adesso ci sono tutti gli adempimenti burocratici,7,25343200000,25367600000,24400000,530,0,0
Sara Monaschi,il passaggio del protocollo e tutte le formalità del caso,7,25372000000,25400000000,28000000,531,0,0
Alberto Anacleti,che cazzo ha detto,7,25413200000,25428000000,14800000,532,1,1
Aureliano Adami,che sei in affari datti una sistemata comprati una camicia una cosa,7,25430800000,25461600000,30800000,533,0,1
Alberto Anacleti,ahó ti stai zitto,7,25462400000,25474800000,12400000,534,0,1
Aureliano Adami,hai visto che ti è convenuto a metterti con noi mona,7,25504800000,25538400000,33600000,535,1,1
Sara Monaschi,beh non è che avessi molte alternative,7,25539200000,25557200000,18000000,536,0,0
Aureliano Adami,va bene è stato un piacere io me ne vado,7,25583600000,25604800000,21200000,537,0,1
Alberto Anacleti,ahó,7,25605600000,25614000000,8400000,538,0,1
Alberto Anacleti,ma come,7,25618800000,25627200000,8400000,539,0,1
Alberto Anacleti,io pensavo che stavamo insieme che festeggiavamo,7,25629200000,25651200000,22000000,540,0,1
Aureliano Adami,no frate ho da fare con isabel facciamo un altra volta,7,25652000000,25675600000,23600000,541,0,1
Alberto Anacleti,ma chi la negra,7,25680400000,25691200000,10800000,542,1,1
Aureliano Adami,eh si chiama isabel,7,25703200000,25714400000,11200000,544,0,1
Aureliano Adami,ciao spadi,7,25732800000,25742800000,10000000,545,0,1
Aureliano Adami,tocca dargli una pulita,7,26998000000,27010000000,12000000,548,0,1
Aureliano Adami,però è bella si vede il mare,7,27013200000,27030000000,16800000,549,0,1
Aureliano Adami,si sta bene qua,7,27078000000,27090000000,12000000,550,0,1
Aureliano Adami,voglio che stai qua con me,7,27236400000,27249200000,12800000,551,0,1
Contessa Sveva Della Rocca Croce,ciao,7,27558000000,27566400000,8400000,553,0,0
Samurai Valerio,è un piacere rivederti,7,27643600000,27659600000,16000000,554,0,1
Samurai Valerio,non sei cambiata per niente dall ultima volta che ci siamo visti,7,27690400000,27721200000,30800000,555,0,1
Contessa Sveva Della Rocca Croce,tu sì invece,7,27729200000,27740800000,11600000,556,0,0
Contessa Sveva Della Rocca Croce,e comunque fra me e te quella bella ero io,7,27756800000,27781200000,24400000,557,0,0
Samurai Valerio,e io chi ero,7,27802800000,27812800000,10000000,558,0,1
Contessa Sveva Della Rocca Croce,un delinquente,7,27836000000,27848800000,12800000,559,0,0
Contessa Sveva Della Rocca Croce,uno che m ha levato tutto quello che avevo,7,27868000000,27889200000,21200000,560,0,0
Contessa Sveva Della Rocca Croce,a cominciare da mio marito,7,27902000000,27920000000,18000000,561,0,0
Samurai Valerio,stai tirando fuori storie vecchie,7,27946400000,27962400000,16000000,562,0,1
Contessa Sveva Della Rocca Croce,non per me,7,27967600000,27977600000,10000000,563,0,0
Contessa Sveva Della Rocca Croce,non c è stato giorno in cui non ci abbia pensato,7,27993200000,28016800000,23600000,564,0,0
Samurai Valerio,quindi,7,28042000000,28050400000,8400000,565,0,1
Samurai Valerio,perché mi hai fatto venire qui,7,28070400000,28088400000,18000000,566,0,1
Samurai Valerio,hai qualcosa da offrirmi,7,28094800000,28106800000,12000000,567,0,1
Contessa Sveva Della Rocca Croce,sara monaschi,7,28119200000,28133600000,14400000,568,0,0
Alberto Anacleti,ah,8,770000000,778400000,8400000,12,0,1
Alberto Anacleti,ma che vuoi,8,862400000,879600000,17200000,15,0,1
Alberto Anacleti,io non ho fatto un cazzo,8,880400000,904800000,24400000,17,1,1
Contessa Sveva Della Rocca Croce,sara scusa se ti chiamo a quest ora,8,1302400000,1324800000,22400000,19,0,0
Contessa Sveva Della Rocca Croce,puoi venire a trovarmi domani mattina,8,1351600000,1372000000,20400000,20,0,0
Contessa Sveva Della Rocca Croce,ti devo parlare di una cosa molto importante,8,1386000000,1409600000,23600000,21,0,0
Contessa Sveva Della Rocca Croce,bene a domani,8,1436400000,1452000000,15600000,22,0,0
Samurai Valerio,abbiamo perso è vero ma ho già risolto tutto,8,1810000000,1835600000,25600000,25,0,1
Samurai Valerio,non c era bisogno di scomodarsi t avrei avvertito,8,1842000000,1866400000,24400000,26,0,1
Samurai Valerio,non potrei vivere da nessun altra parte,8,1982000000,2000400000,18400000,30,0,1
Samurai Valerio,vai sto bene,8,2754000000,2768400000,14400000,35,0,1
Alberto Anacleti,come stai,8,3164000000,3173600000,9600000,37,0,1
Angelica Sale,come una che s è presa una pallottola al posto di un altro,8,3176800000,3204800000,28000000,38,0,0
Alberto Anacleti,però io non ti ho chiesto di andarci al posto mio,8,3208400000,3228000000,19600000,39,0,1
Angelica Sale,tra moglie e marito si fa così,8,3233200000,3248800000,15600000,40,0,0
Angelica Sale,anche se è solo un graffio mi fa male,8,3374800000,3394400000,19600000,41,0,0
Angelica Sale,non sono tua sorella,8,3430400000,3446000000,15600000,42,0,0
Angelica Sale,è la seconda volta che ti copro,8,3488400000,3505600000,17200000,43,0,0
Angelica Sale,e non so neanche dove cazzo stavi,8,3513200000,3532000000,18800000,44,1,0
Angelica Sale,io mi sono stufata spadi,8,3535600000,3561200000,25600000,45,0,0
Alberto Anacleti,senti ange,8,3535600000,3561200000,25600000,46,0,1
Angelica Sale,dimmi,8,3579200000,3588000000,8800000,47,0,0
Alberto Anacleti,andiamo a dormire,8,3618000000,3632400000,14400000,48,0,1
Samurai Valerio,ne ho fatte tante in vita mia,8,3738000000,3752000000,14000000,49,0,1
Samurai Valerio,ma una fine così del cazzo non me la sarei mai immaginata,8,3752800000,3778800000,26000000,50,1,1
Samurai Valerio,ma poteva succedere questo è il problema,8,3811600000,3831200000,19600000,52,0,1
Samurai Valerio,e stava a succedere proprio a me,8,3832000000,3850400000,18400000,53,0,1
Samurai Valerio,a fare che,8,3888000000,3896400000,8400000,55,0,1
Samurai Valerio,ci tocca andare,8,4007200000,4017600000,10400000,57,0,1
Samurai Valerio,tra un po arrivano gli adami e gli zingari giù al maneggio,8,4028800000,4055200000,26400000,58,0,1
Manfredi Anacleti,allora non hai niente da dire,8,4255200000,4277600000,22400000,60,0,1
Alberto Anacleti,alla fine non è successo niente,8,4308000000,4322400000,14400000,61,0,1
Manfredi Anacleti,a momenti muore e tu dici che non è successo niente,8,4327200000,4352400000,25200000,62,0,1
Manfredi Anacleti,boh,8,4353200000,4361600000,8400000,63,0,1
Alberto Anacleti,va bene,8,4388000000,4410000000,22000000,64,0,1
Manfredi Anacleti,dove credi di andare,8,4388000000,4410000000,22000000,65,0,1
Manfredi Anacleti,tu devi venire con me,8,4410800000,4424800000,14000000,66,0,1
Manfredi Anacleti,pischello eri e pischello sei rimasto,8,4436800000,4461200000,24400000,67,0,1
Manfredi Anacleti,mo devi chiedere il permesso pure per andare al cesso,8,4462000000,4490800000,28800000,68,1,1
Amedeo Cinaglia,ma perché,8,4595600000,4604400000,8800000,70,0,1
Amedeo Cinaglia,lo sai che ci sono affezionato no,8,4628400000,4646400000,18000000,72,0,1
Amedeo Cinaglia,dici,8,4697200000,4722400000,25200000,74,0,1
Aureliano Adami,mi piace che stai qui,8,4938800000,4950400000,11600000,77,0,1
Aureliano Adami,che giri per casa,8,4959200000,4972000000,12800000,78,0,1
Aureliano Adami,dopo prendiamo la roba tua così la riempiamo,8,5025600000,5044800000,19200000,80,0,1
Livia Adami,non ti preoccupare ci sta romolo,8,5207600000,5224400000,16800000,82,0,0
Livia Adami,non sto da sola te l ho già detto,8,5263600000,5285200000,21600000,84,0,0
Livia Adami,ci sta romolo,8,5289600000,5300800000,11200000,85,0,0
Livia Adami,tranquillo,8,5308000000,5317200000,9200000,86,0,0
Livia Adami,dai,8,5366800000,5375600000,8800000,87,0,0
Manfredi Anacleti,tu resti qua a fare la guardia insieme agli altri,8,5560800000,5591200000,30400000,88,0,1
Samurai Valerio,errori ne avete fatti da tutte e due le parti,8,5699600000,5718400000,18800000,89,0,1
Samurai Valerio,però loro sono gli adami,8,5719200000,5735200000,16000000,90,0,1
Livia Adami,e tu la morte di mio padre la chiami un errore,8,5741600000,5761200000,19600000,91,0,0
Manfredi Anacleti,chiamala come ti pare ma noi non siamo stati,8,5768800000,5789200000,20400000,92,0,1
Livia Adami,no sono stata io,8,5797200000,5810400000,13200000,93,0,0
Manfredi Anacleti,è un problema tuo,8,5811200000,5823200000,12000000,94,0,1
Livia Adami,io al tavolo con uno zingaro non mi ci siedo,8,5836000000,5859200000,23200000,95,0,0
Samurai Valerio,aspetta,8,5860000000,5869600000,9600000,96,0,1
Samurai Valerio,gli uomini tuoi hanno fatto una cazzata giù al bar,8,5884800000,5908000000,23200000,97,1,1
Samurai Valerio,non vi dovevate permettere,8,5908800000,5922000000,13200000,98,0,1
Samurai Valerio,quindi adesso risarcite livia,8,5930000000,5944000000,14000000,99,0,1
Samurai Valerio,e ve ne tornate nelle vostre belle villette del cazzo,8,5944800000,5973600000,28800000,100,1,1
Manfredi Anacleti,ma che ne so io che gli adami si sono presi pure i baretti all eur,8,5980800000,6012400000,31600000,101,0,1
Samurai Valerio,ora lo sai,8,6013200000,6022800000,9600000,102,0,1
Manfredi Anacleti,ma questa già c ha tutta ostia a che le serve allargarsi fino all eur,8,6030400000,6069600000,39200000,103,0,1
Manfredi Anacleti,eh e noi un cazzo,8,6070400000,6086800000,16400000,104,1,1
Samurai Valerio,voi non siete un cazzo manfre,8,6087600000,6107200000,19600000,105,1,1
Samurai Valerio,loro sono gli adami,8,6108000000,6119200000,11200000,106,0,1
Manfredi Anacleti,gira voce che a tuo fratello di ostia non gliene frega più niente,8,6179200000,6212000000,32800000,107,0,1
Manfredi Anacleti,e tu da sola non ce la puoi fare,8,6228800000,6244800000,16000000,108,0,1
Livia Adami,tu ostia non la devi neanche nominare,8,6262000000,6280400000,18400000,109,0,0
Samurai Valerio,manfre abbiamo finito,8,6304800000,6317600000,12800000,110,0,1
Samurai Valerio,tu ora stai a posto io no,8,6444800000,6464400000,19600000,111,0,1
Samurai Valerio,sto aspettando ancora la firma tua e di tuo fratello,8,6472800000,6494000000,21200000,112,0,1
Samurai Valerio,per i terreni che mi hai promesso,8,6494800000,6514000000,19200000,113,0,1
Manfredi Anacleti,un cazzo che ma non lo usi il cervello,8,6525200000,6559200000,34000000,115,1,1
Manfredi Anacleti,per noi se stiamo qua è già una vittoria quando ci siamo mai seduti a sti tavoli,8,6602400000,6641600000,39200000,117,0,1
Manfredi Anacleti,andiamo dai,8,6648000000,6656400000,8400000,118,0,1
Amedeo Cinaglia,un giro per negozi,8,7220800000,7231600000,10800000,121,0,1
Amedeo Cinaglia,lo vedi che ti sbagliavi l ultima volta,8,7274400000,7291600000,17200000,124,0,1
Amedeo Cinaglia,dicevi che io e te non avevamo niente da dirci e invece guardaci qua,8,7297200000,7326800000,29600000,125,0,1
Amedeo Cinaglia,a parlare delle mie scarpe,8,7334400000,7348000000,13600000,126,0,1
Amedeo Cinaglia,come ai vecchi tempi,8,7354800000,7384800000,30000000,127,0,1
Amedeo Cinaglia,t ho deluso gabrie,8,7404800000,7417200000,12400000,130,0,1
Amedeo Cinaglia,pensavi che sarei rimasto al posto mio buono buono come sempre,8,7446400000,7476000000,29600000,132,0,1
Amedeo Cinaglia,e invece t ho deluso,8,7485200000,7497200000,12000000,133,0,1
Contessa Sveva Della Rocca Croce,le cose sono cambiate sara,8,7653600000,7672000000,18400000,134,0,0
Contessa Sveva Della Rocca Croce,i terreni di ostia li devi dare a samurai,8,7680800000,7707200000,26400000,135,0,0
Sara Monaschi,è uno scherzo,8,7714800000,7728000000,13200000,136,0,0
Contessa Sveva Della Rocca Croce,tuo marito rinuncia alla compravendita,8,7737200000,7758800000,21600000,137,0,0
Contessa Sveva Della Rocca Croce,e i terreni in automatico vanno alla ditta di samurai,8,7759600000,7787600000,28000000,138,0,0
Contessa Sveva Della Rocca Croce,manca solo la ratifica,8,7794000000,7808000000,14000000,139,0,0
Sara Monaschi,non capisco,8,7814000000,7824400000,10400000,140,0,0
Contessa Sveva Della Rocca Croce,cosa c è da capire,8,7827600000,7837600000,10000000,141,0,0
Contessa Sveva Della Rocca Croce,oppure pensi davvero che avrei invitato a casa mia un fallito come sandro,8,7846400000,7886000000,39600000,142,0,0
Contessa Sveva Della Rocca Croce,mi servivi tu per andare contro samurai,8,7894800000,7917200000,22400000,143,0,0
Contessa Sveva Della Rocca Croce,prima gli ho creato un ostacolo e poi gliel ho risolto,8,7924000000,7952000000,28000000,144,0,0
Contessa Sveva Della Rocca Croce,lui si prende i terreni e io mi riprendo l impero di mio marito,8,7955600000,7991200000,35600000,145,0,0
Contessa Sveva Della Rocca Croce,ed eccoci qua,8,7992000000,8005600000,13600000,146,0,0
Sara Monaschi,io a quei terreni non ci rinuncio,8,8012000000,8030000000,18000000,147,0,0
Contessa Sveva Della Rocca Croce,fallo,8,8033600000,8043600000,10000000,148,0,0
Contessa Sveva Della Rocca Croce,o ti denuncio per la storia di theodosiou,8,8048400000,8075600000,27200000,149,0,0
Sara Monaschi,non ha nessuna prova,8,8082800000,8110000000,27200000,150,0,0
Contessa Sveva Della Rocca Croce,ho il mio salotto,8,8082800000,8110000000,27200000,151,0,0
Contessa Sveva Della Rocca Croce,qualcuno parla della morte sospetta del monsignore,8,8121600000,8155200000,33600000,152,0,0
Contessa Sveva Della Rocca Croce,le voci corrono gli inquirenti cominciano a indagare,8,8156000000,8191600000,35600000,153,0,0
Contessa Sveva Della Rocca Croce,mettono in discussione l autopsia,8,8192400000,8214000000,21600000,154,0,0
Contessa Sveva Della Rocca Croce,e il medico legale crolla e racconta tutto,8,8219600000,8245200000,25600000,155,0,0
Contessa Sveva Della Rocca Croce,tu sara l hai costretto a coprire il suicidio,8,8257200000,8293200000,36000000,156,0,0
Contessa Sveva Della Rocca Croce,col tempo mi capirai,8,8314800000,8333200000,18400000,157,0,0
Contessa Sveva Della Rocca Croce,adesso vado che i poveri mi aspettano,8,8341200000,8365600000,24400000,158,0,0
Angelica Sale,com è andata,8,8659600000,8671200000,11600000,161,0,0
Alberto Anacleti,boh male ma pare bene,8,8691600000,8710000000,18400000,162,0,1
Angelica Sale,senti albe che mi stavi per dire stanotte,8,8745600000,8763200000,17600000,163,0,0
Angelica Sale,oh,8,8787200000,8795600000,8400000,164,0,0
Alberto Anacleti,ridammi il telefono,8,8827600000,8841600000,14000000,165,0,1
Alberto Anacleti,quando ti dico una cosa è quella,8,8869200000,8883600000,14400000,166,0,1
Angelica Sale,stavi con l amante tua vero perciò non vuoi fare l amore con me,8,8952800000,8982400000,29600000,167,0,0
Samurai Valerio,tu la monaschi e quelle altre due merde vi siete messi in società contro di me,8,9302000000,9342400000,40400000,169,1,1
Samurai Valerio,secondo te non lo scoprivo,8,9356400000,9370400000,14000000,170,0,1
Samurai Valerio,adesso ascolta,8,9405200000,9418800000,13600000,171,0,1
Samurai Valerio,tu me li hai messi davanti tu me li devi levare,8,9425200000,9451600000,26400000,172,0,1
Samurai Valerio,subito,8,9458000000,9466400000,8400000,173,0,1
Gabriele Marchilli,posso spiegare un attimo,8,9479200000,9492000000,12800000,174,0,1
Samurai Valerio,spiegami che fine ha fatto quel sorrisetto falso di prima,8,9496400000,9525600000,29200000,175,0,1
Samurai Valerio,dove l hai messo,8,9532000000,9542000000,10000000,176,0,1
Samurai Valerio,mo mi devi togliere dal cazzo gli amichetti tuoi,8,9552800000,9574800000,22000000,177,1,1
Gabriele Marchilli,ma come faccio,8,9593600000,9602800000,9200000,178,0,1
Samurai Valerio,me li porti a dama,8,9643200000,9656800000,13600000,179,0,1
Samurai Valerio,gli dai appuntamento a mezzanotte al parcheggio di piazza mancini,8,9666400000,9696000000,29600000,180,0,1
Samurai Valerio,e poi ci andiamo noi al posto tuo,8,9696800000,9711600000,14800000,181,0,1
Samurai Valerio,se no racconto quello che hai fatto a tullio adami prima a tuo padre,8,9712400000,9742800000,30400000,182,0,1
Samurai Valerio,e poi ad aureliano,8,9743600000,9757200000,13600000,183,0,1
Gabriele Marchilli,e a me,8,9791600000,9801200000,9600000,184,0,1
Gabriele Marchilli,a me che succede,8,9820800000,9830800000,10000000,185,0,1
Samurai Valerio,il figlio di una guardia serve sempre,8,9869200000,9888000000,18800000,186,0,1
Aureliano Adami,ahó,8,10488400000,10497600000,9200000,187,0,1
Alberto Anacleti,lele l hai sentito,8,10502400000,10513600000,11200000,188,0,1
Aureliano Adami,no,8,10519200000,10528400000,9200000,189,0,1
Alberto Anacleti,la monaschi che fine ha fatto che ci vuole a mettere una firma,8,10536400000,10565200000,28800000,190,0,1
Aureliano Adami,che cazzo ne so spadi ci vorrà un po mi hai chiamato per questo,8,10579200000,10612800000,33600000,191,1,1
Alberto Anacleti,ti ho chiamato perché oggi le nostre famiglie,8,10634800000,10658400000,23600000,192,0,1
Alberto Anacleti,si sono viste da samurai,8,10659200000,10669200000,10000000,193,0,1
Alberto Anacleti,hanno fatto un patto ma secondo me non dura molto,8,10678800000,10706400000,27600000,194,0,1
Aureliano Adami,sono cazzi loro,8,10730000000,10740800000,10800000,195,1,1
Alberto Anacleti,eh magari,8,10743600000,10753200000,9600000,196,0,1
Alberto Anacleti,ieri un altro po e la donna mia ci rimaneva secca al baretto,8,10758400000,10783200000,24800000,197,0,1
Aureliano Adami,che cazzo stava a fare là,8,10795600000,10809200000,13600000,198,1,1
Alberto Anacleti,niente dovevo fare una consegna e ci è andata lei al posto mio,8,10824000000,10851600000,27600000,199,0,1
Aureliano Adami,che s è fatta,8,10881600000,10890800000,9200000,200,0,1
Alberto Anacleti,niente per fortuna,8,10900400000,10912400000,12000000,201,0,1
Aureliano Adami,meno male,8,10923600000,10933600000,10000000,202,0,1
Aureliano Adami,frate io me ne devo andare ho da fare il trasloco con isabel,8,11032400000,11062400000,30000000,203,0,1
Aureliano Adami,stai tranquillo,8,11063200000,11074000000,10800000,204,0,1
Alberto Anacleti,te la stai portando a casa,8,11080000000,11093200000,13200000,205,0,1
Aureliano Adami,ci dovrò provare pure io no,8,11105200000,11118400000,13200000,206,0,1
Aureliano Adami,sta meglio a te che a me sto cappello tieni te lo regalo,8,11160000000,11188000000,28000000,207,0,1
Aureliano Adami,va da tua moglie che c ha bisogno,8,11202000000,11218800000,16800000,208,0,1
Livia Adami,hai ragione,8,11568000000,11579600000,11600000,210,0,0
Livia Adami,ma aureliano non ha ancora firmato,8,11590400000,11606400000,16000000,211,0,0
Livia Adami,e samurai vuole subito i terreni che gli ho promesso,8,11607200000,11633200000,26000000,212,0,0
Livia Adami,se mi risponde chissà che sta a fare,8,11693200000,11711200000,18000000,214,0,0
Livia Adami,che dovrebbe essere qua in questa famiglia,8,11732400000,11757200000,24800000,216,0,0
Livia Adami,che mi stai a dire,8,11811200000,11820400000,9200000,218,0,0
Livia Adami,eh,8,11832000000,11840400000,8400000,219,0,0
Livia Adami,non può essere ma che dici,8,11911200000,11935200000,24000000,221,0,0
Livia Adami,una negra del cazzo,8,11982800000,11992400000,9600000,224,1,0
Livia Adami,spiccicato a mio padre,8,12054800000,12068800000,14000000,226,0,0
Livia Adami,e dove stanno,8,12176400000,12187200000,10800000,228,0,0
Livia Adami,dimmi dove cazzo stanno,8,12223200000,12236800000,13600000,230,1,0
Gabriele Marchilli,papà,8,12854400000,12863600000,9200000,234,0,1
Gabriele Marchilli,papà mi devi aiutare,8,12904400000,12916000000,11600000,235,0,1
Gabriele Marchilli,ti racconto tutto,8,12978000000,12987600000,9600000,237,0,1
Gabriele Marchilli,senza bugie,8,13004000000,13012400000,8400000,238,0,1
Gabriele Marchilli,stavolta no,8,13100000000,13117600000,17600000,240,0,1
Gabriele Marchilli,sono tutte storie del cazzo giri da poco,8,13213200000,13240000000,26800000,243,1,1
Gabriele Marchilli,mi hanno chiesto di partecipare a uno scambio stasera,8,13355200000,13378000000,22800000,246,0,1
Gabriele Marchilli,mezzo etto di coca,8,13386400000,13396000000,9600000,247,0,1
Gabriele Marchilli,lo devono portare due ragazzi,8,13413200000,13428400000,15200000,248,0,1
Gabriele Marchilli,senti un conto è qualche pippata a una festa,8,13464000000,13484800000,20800000,249,0,1
Gabriele Marchilli,ma io non ho mai spacciato in vita mia e non voglio cominciare stasera,8,13501200000,13532000000,30800000,250,0,1
Gabriele Marchilli,me la voglio riprendere in mano la vita mia,8,13540000000,13557600000,17600000,251,0,1
