character,script_line,season,episode,begin,end,duration,episode_index,bad_words,is_male,is_character
Amedeo Cinaglia,dici,1,8,4697200000,4722400000,25200000,74,0,1.0,1
Alice,fatti un giro magari ti convinci,1,8,4697200000,4722400000,25200000,75,0,0.0,1
Isabelle Mbamba,che c è,1,8,4919600000,4928000000,8400000,76,0,0.0,1
Aureliano Adami,mi piace che stai qui,1,8,4938800000,4950400000,11600000,77,0,1.0,1
Aureliano Adami,che giri per casa,1,8,4959200000,4972000000,12800000,78,0,1.0,1
Isabelle Mbamba,non ho mai visto una casa così grande,1,8,4991200000,5008000000,16800000,79,0,0.0,1
Aureliano Adami,dopo prendiamo la roba tua così la riempiamo,1,8,5025600000,5044800000,19200000,80,0,1.0,1
Ezio Quirino,senti vengo con te,1,8,5154000000,5163600000,9600000,81,0,1.0,1
Livia Adami,non ti preoccupare ci sta romolo,1,8,5207600000,5224400000,16800000,82,0,0.0,1
Ezio Quirino,ho capito ma io non sono come tuo fratello io non ti lascio sola,1,8,5225200000,5256400000,31200000,83,0,1.0,1
Livia Adami,non sto da sola te l ho già detto,1,8,5263600000,5285200000,21600000,84,0,0.0,1
Livia Adami,ci sta romolo,1,8,5289600000,5300800000,11200000,85,0,0.0,1
Livia Adami,tranquillo,1,8,5308000000,5317200000,9200000,86,0,0.0,1
Livia Adami,dai,1,8,5366800000,5375600000,8800000,87,0,0.0,1
Manfredi Anacleti,tu resti qua a fare la guardia insieme agli altri,1,8,5560800000,5591200000,30400000,88,0,1.0,1
Samurai Valerio,errori ne avete fatti da tutte e due le parti,1,8,5699600000,5718400000,18800000,89,0,1.0,1
Samurai Valerio,però loro sono gli adami,1,8,5719200000,5735200000,16000000,90,0,1.0,1
Livia Adami,e tu la morte di mio padre la chiami un errore,1,8,5741600000,5761200000,19600000,91,0,0.0,1
Manfredi Anacleti,chiamala come ti pare ma noi non siamo stati,1,8,5768800000,5789200000,20400000,92,0,1.0,1
Livia Adami,no sono stata io,1,8,5797200000,5810400000,13200000,93,0,0.0,1
Manfredi Anacleti,è un problema tuo,1,8,5811200000,5823200000,12000000,94,0,1.0,1
Livia Adami,io al tavolo con uno zingaro non mi ci siedo,1,8,5836000000,5859200000,23200000,95,0,0.0,1
Samurai Valerio,aspetta,1,8,5860000000,5869600000,9600000,96,0,1.0,1
Samurai Valerio,gli uomini tuoi hanno fatto una cazzata giù al bar,1,8,5884800000,5908000000,23200000,97,1,1.0,1
Samurai Valerio,non vi dovevate permettere,1,8,5908800000,5922000000,13200000,98,0,1.0,1
Samurai Valerio,quindi adesso risarcite livia,1,8,5930000000,5944000000,14000000,99,0,1.0,1
Samurai Valerio,e ve ne tornate nelle vostre belle villette del cazzo,1,8,5944800000,5973600000,28800000,100,1,1.0,1
Manfredi Anacleti,ma che ne so io che gli adami si sono presi pure i baretti all eur,1,8,5980800000,6012400000,31600000,101,0,1.0,1
Samurai Valerio,ora lo sai,1,8,6013200000,6022800000,9600000,102,0,1.0,1
Manfredi Anacleti,ma questa già c ha tutta ostia a che le serve allargarsi fino all eur,1,8,6030400000,6069600000,39200000,103,0,1.0,1
Manfredi Anacleti,eh e noi un cazzo,1,8,6070400000,6086800000,16400000,104,1,1.0,1
Samurai Valerio,voi non siete un cazzo manfre,1,8,6087600000,6107200000,19600000,105,1,1.0,1
Samurai Valerio,loro sono gli adami,1,8,6108000000,6119200000,11200000,106,0,1.0,1
Manfredi Anacleti,gira voce che a tuo fratello di ostia non gliene frega più niente,1,8,6179200000,6212000000,32800000,107,0,1.0,1
Manfredi Anacleti,e tu da sola non ce la puoi fare,1,8,6228800000,6244800000,16000000,108,0,1.0,1
Livia Adami,tu ostia non la devi neanche nominare,1,8,6262000000,6280400000,18400000,109,0,0.0,1
Samurai Valerio,manfre abbiamo finito,1,8,6304800000,6317600000,12800000,110,0,1.0,1
Samurai Valerio,tu ora stai a posto io no,1,8,6444800000,6464400000,19600000,111,0,1.0,1
Samurai Valerio,sto aspettando ancora la firma tua e di tuo fratello,1,8,6472800000,6494000000,21200000,112,0,1.0,1
Samurai Valerio,per i terreni che mi hai promesso,1,8,6494800000,6514000000,19200000,113,0,1.0,1
Manfredi Anacleti,un cazzo che ma non lo usi il cervello,1,8,6525200000,6559200000,34000000,115,1,1.0,1
Manfredi Anacleti,per noi se stiamo qua è già una vittoria quando ci siamo mai seduti a sti tavoli,1,8,6602400000,6641600000,39200000,117,0,1.0,1
Manfredi Anacleti,andiamo dai,1,8,6648000000,6656400000,8400000,118,0,1.0,1
Gabriella,che ci fai qua,1,8,7207600000,7216000000,8400000,120,0,0.0,1
Amedeo Cinaglia,un giro per negozi,1,8,7220800000,7231600000,10800000,121,0,1.0,1
Gabriella,bugiardo tu li odii i negozi,1,8,7232400000,7251200000,18800000,122,0,0.0,1
Gabriella,guarda ancora come vai in giro,1,8,7252000000,7265600000,13600000,123,0,0.0,1
Amedeo Cinaglia,lo vedi che ti sbagliavi l ultima volta,1,8,7274400000,7291600000,17200000,124,0,1.0,1
Amedeo Cinaglia,dicevi che io e te non avevamo niente da dirci e invece guardaci qua,1,8,7297200000,7326800000,29600000,125,0,1.0,1
Amedeo Cinaglia,a parlare delle mie scarpe,1,8,7334400000,7348000000,13600000,126,0,1.0,1
Amedeo Cinaglia,come ai vecchi tempi,1,8,7354800000,7384800000,30000000,127,0,1.0,1
Gabriella,tesoro i vecchi tempi non esistono più,1,8,7354800000,7384800000,30000000,128,0,0.0,1
Gabriella,e neanche tu,1,8,7385600000,7394800000,9200000,129,0,0.0,1
Amedeo Cinaglia,t ho deluso gabrie,1,8,7404800000,7417200000,12400000,130,0,1.0,1
Gabriella,mi lasci per favore,1,8,7422800000,7436000000,13200000,131,0,0.0,1
Amedeo Cinaglia,pensavi che sarei rimasto al posto mio buono buono come sempre,1,8,7446400000,7476000000,29600000,132,0,1.0,1
Amedeo Cinaglia,e invece t ho deluso,1,8,7485200000,7497200000,12000000,133,0,1.0,1
Contessa Sveva Della Rocca Croce,le cose sono cambiate sara,1,8,7653600000,7672000000,18400000,134,0,0.0,1
Contessa Sveva Della Rocca Croce,i terreni di ostia li devi dare a samurai,1,8,7680800000,7707200000,26400000,135,0,0.0,1
Sara Monaschi,è uno scherzo,1,8,7714800000,7728000000,13200000,136,0,0.0,1
Contessa Sveva Della Rocca Croce,tuo marito rinuncia alla compravendita,1,8,7737200000,7758800000,21600000,137,0,0.0,1
Contessa Sveva Della Rocca Croce,e i terreni in automatico vanno alla ditta di samurai,1,8,7759600000,7787600000,28000000,138,0,0.0,1
Contessa Sveva Della Rocca Croce,manca solo la ratifica,1,8,7794000000,7808000000,14000000,139,0,0.0,1
Sara Monaschi,non capisco,1,8,7814000000,7824400000,10400000,140,0,0.0,1
Contessa Sveva Della Rocca Croce,cosa c è da capire,1,8,7827600000,7837600000,10000000,141,0,0.0,1
Contessa Sveva Della Rocca Croce,oppure pensi davvero che avrei invitato a casa mia un fallito come sandro,1,8,7846400000,7886000000,39600000,142,0,0.0,1
Contessa Sveva Della Rocca Croce,mi servivi tu per andare contro samurai,1,8,7894800000,7917200000,22400000,143,0,0.0,1
Contessa Sveva Della Rocca Croce,prima gli ho creato un ostacolo e poi gliel ho risolto,1,8,7924000000,7952000000,28000000,144,0,0.0,1
Contessa Sveva Della Rocca Croce,lui si prende i terreni e io mi riprendo l impero di mio marito,1,8,7955600000,7991200000,35600000,145,0,0.0,1
Contessa Sveva Della Rocca Croce,ed eccoci qua,1,8,7992000000,8005600000,13600000,146,0,0.0,1
Sara Monaschi,io a quei terreni non ci rinuncio,1,8,8012000000,8030000000,18000000,147,0,0.0,1
Contessa Sveva Della Rocca Croce,fallo,1,8,8033600000,8043600000,10000000,148,0,0.0,1
Contessa Sveva Della Rocca Croce,o ti denuncio per la storia di theodosiou,1,8,8048400000,8075600000,27200000,149,0,0.0,1
Sara Monaschi,non ha nessuna prova,1,8,8082800000,8110000000,27200000,150,0,0.0,1
Contessa Sveva Della Rocca Croce,ho il mio salotto,1,8,8082800000,8110000000,27200000,151,0,0.0,1
Contessa Sveva Della Rocca Croce,qualcuno parla della morte sospetta del monsignore,1,8,8121600000,8155200000,33600000,152,0,0.0,1
Contessa Sveva Della Rocca Croce,le voci corrono gli inquirenti cominciano a indagare,1,8,8156000000,8191600000,35600000,153,0,0.0,1
Contessa Sveva Della Rocca Croce,mettono in discussione l autopsia,1,8,8192400000,8214000000,21600000,154,0,0.0,1
Contessa Sveva Della Rocca Croce,e il medico legale crolla e racconta tutto,1,8,8219600000,8245200000,25600000,155,0,0.0,1
Contessa Sveva Della Rocca Croce,tu sara l hai costretto a coprire il suicidio,1,8,8257200000,8293200000,36000000,156,0,0.0,1
Contessa Sveva Della Rocca Croce,col tempo mi capirai,1,8,8314800000,8333200000,18400000,157,0,0.0,1
Contessa Sveva Della Rocca Croce,adesso vado che i poveri mi aspettano,1,8,8341200000,8365600000,24400000,158,0,0.0,1
Angelica Sale,com è andata,1,8,8659600000,8671200000,11600000,161,0,0.0,1
Alberto Anacleti,boh male ma pare bene,1,8,8691600000,8710000000,18400000,162,0,1.0,1
Angelica Sale,senti albe che mi stavi per dire stanotte,1,8,8745600000,8763200000,17600000,163,0,0.0,1
Angelica Sale,oh,1,8,8787200000,8795600000,8400000,164,0,0.0,1
Alberto Anacleti,ridammi il telefono,1,8,8827600000,8841600000,14000000,165,0,1.0,1
Alberto Anacleti,quando ti dico una cosa è quella,1,8,8869200000,8883600000,14400000,166,0,1.0,1
Angelica Sale,stavi con l amante tua vero perciò non vuoi fare l amore con me,1,8,8952800000,8982400000,29600000,167,0,0.0,1
Samurai Valerio,tu la monaschi e quelle altre due merde vi siete messi in società contro di me,1,8,9302000000,9342400000,40400000,169,1,1.0,1
Samurai Valerio,secondo te non lo scoprivo,1,8,9356400000,9370400000,14000000,170,0,1.0,1
Samurai Valerio,adesso ascolta,1,8,9405200000,9418800000,13600000,171,0,1.0,1
Samurai Valerio,tu me li hai messi davanti tu me li devi levare,1,8,9425200000,9451600000,26400000,172,0,1.0,1
Samurai Valerio,subito,1,8,9458000000,9466400000,8400000,173,0,1.0,1
Gabriele Marchilli,posso spiegare un attimo,1,8,9479200000,9492000000,12800000,174,0,1.0,1
Samurai Valerio,spiegami che fine ha fatto quel sorrisetto falso di prima,1,8,9496400000,9525600000,29200000,175,0,1.0,1
Samurai Valerio,dove l hai messo,1,8,9532000000,9542000000,10000000,176,0,1.0,1
Samurai Valerio,mo mi devi togliere dal cazzo gli amichetti tuoi,1,8,9552800000,9574800000,22000000,177,1,1.0,1
Gabriele Marchilli,ma come faccio,1,8,9593600000,9602800000,9200000,178,0,1.0,1
Samurai Valerio,me li porti a dama,1,8,9643200000,9656800000,13600000,179,0,1.0,1
Samurai Valerio,gli dai appuntamento a mezzanotte al parcheggio di piazza mancini,1,8,9666400000,9696000000,29600000,180,0,1.0,1
Samurai Valerio,e poi ci andiamo noi al posto tuo,1,8,9696800000,9711600000,14800000,181,0,1.0,1
Samurai Valerio,se no racconto quello che hai fatto a tullio adami prima a tuo padre,1,8,9712400000,9742800000,30400000,182,0,1.0,1
Samurai Valerio,e poi ad aureliano,1,8,9743600000,9757200000,13600000,183,0,1.0,1
Gabriele Marchilli,e a me,1,8,9791600000,9801200000,9600000,184,0,1.0,1
Gabriele Marchilli,a me che succede,1,8,9820800000,9830800000,10000000,185,0,1.0,1
Samurai Valerio,il figlio di una guardia serve sempre,1,8,9869200000,9888000000,18800000,186,0,1.0,1
Aureliano Adami,ahó,1,8,10488400000,10497600000,9200000,187,0,1.0,1
Alberto Anacleti,lele l hai sentito,1,8,10502400000,10513600000,11200000,188,0,1.0,1
Aureliano Adami,no,1,8,10519200000,10528400000,9200000,189,0,1.0,1
Alberto Anacleti,la monaschi che fine ha fatto che ci vuole a mettere una firma,1,8,10536400000,10565200000,28800000,190,0,1.0,1
Aureliano Adami,che cazzo ne so spadi ci vorrà un po mi hai chiamato per questo,1,8,10579200000,10612800000,33600000,191,1,1.0,1
Alberto Anacleti,ti ho chiamato perché oggi le nostre famiglie,1,8,10634800000,10658400000,23600000,192,0,1.0,1
Alberto Anacleti,si sono viste da samurai,1,8,10659200000,10669200000,10000000,193,0,1.0,1
Alberto Anacleti,hanno fatto un patto ma secondo me non dura molto,1,8,10678800000,10706400000,27600000,194,0,1.0,1
Aureliano Adami,sono cazzi loro,1,8,10730000000,10740800000,10800000,195,1,1.0,1
Alberto Anacleti,eh magari,1,8,10743600000,10753200000,9600000,196,0,1.0,1
Alberto Anacleti,ieri un altro po e la donna mia ci rimaneva secca al baretto,1,8,10758400000,10783200000,24800000,197,0,1.0,1
Aureliano Adami,che cazzo stava a fare là,1,8,10795600000,10809200000,13600000,198,1,1.0,1
Alberto Anacleti,niente dovevo fare una consegna e ci è andata lei al posto mio,1,8,10824000000,10851600000,27600000,199,0,1.0,1
Aureliano Adami,che s è fatta,1,8,10881600000,10890800000,9200000,200,0,1.0,1
Alberto Anacleti,niente per fortuna,1,8,10900400000,10912400000,12000000,201,0,1.0,1
Aureliano Adami,meno male,1,8,10923600000,10933600000,10000000,202,0,1.0,1
Aureliano Adami,frate io me ne devo andare ho da fare il trasloco con isabel,1,8,11032400000,11062400000,30000000,203,0,1.0,1
Aureliano Adami,stai tranquillo,1,8,11063200000,11074000000,10800000,204,0,1.0,1
Alberto Anacleti,te la stai portando a casa,1,8,11080000000,11093200000,13200000,205,0,1.0,1
Aureliano Adami,ci dovrò provare pure io no,1,8,11105200000,11118400000,13200000,206,0,1.0,1
Aureliano Adami,sta meglio a te che a me sto cappello tieni te lo regalo,1,8,11160000000,11188000000,28000000,207,0,1.0,1
Aureliano Adami,va da tua moglie che c ha bisogno,1,8,11202000000,11218800000,16800000,208,0,1.0,1
Ezio Quirino,mi sembra che dovresti essere contenta no,1,8,11537600000,11556800000,19200000,209,0,1.0,1
Livia Adami,hai ragione,1,8,11568000000,11579600000,11600000,210,0,0.0,1
Livia Adami,ma aureliano non ha ancora firmato,1,8,11590400000,11606400000,16000000,211,0,0.0,1
Livia Adami,e samurai vuole subito i terreni che gli ho promesso,1,8,11607200000,11633200000,26000000,212,0,0.0,1
Ezio Quirino,devi parlare con tuo fratello li,1,8,11672000000,11690000000,18000000,213,0,1.0,1
Livia Adami,se mi risponde chissà che sta a fare,1,8,11693200000,11711200000,18000000,214,0,0.0,1
Ezio Quirino,la vita sua sta a fare,1,8,11714400000,11728000000,13600000,215,0,1.0,1
Livia Adami,che dovrebbe essere qua in questa famiglia,1,8,11732400000,11757200000,24800000,216,0,0.0,1
Ezio Quirino,sì ma a un certo punto uno cresce e se ne fa un altra di famiglia no,1,8,11762800000,11791600000,28800000,217,0,1.0,1
Livia Adami,che mi stai a dire,1,8,11811200000,11820400000,9200000,218,0,0.0,1
Livia Adami,eh,1,8,11832000000,11840400000,8400000,219,0,0.0,1
Ezio Quirino,niente l hanno visto in giro per ostia con una negra tutto qua,1,8,11870000000,11898800000,28800000,220,1,1.0,1
Livia Adami,non può essere ma che dici,1,8,11911200000,11935200000,24000000,221,0,0.0,1
Ezio Quirino,sì è normale,1,8,11911200000,11935200000,24000000,222,0,1.0,1
Ezio Quirino,è meglio per lui è meglio per tutti dai,1,8,11936000000,11956000000,20000000,223,0,1.0,1
Livia Adami,una negra del cazzo,1,8,11982800000,11992400000,9600000,224,1,0.0,1
Ezio Quirino,sì,1,8,12007200000,12016000000,8800000,225,0,1.0,1
Livia Adami,spiccicato a mio padre,1,8,12054800000,12068800000,14000000,226,0,0.0,1
Ezio Quirino,sono pure andati a vivere insieme,1,8,12122400000,12138800000,16400000,227,0,1.0,1
Livia Adami,e dove stanno,1,8,12176400000,12187200000,10800000,228,0,0.0,1
Ezio Quirino,dai,1,8,12208800000,12217200000,8400000,229,0,1.0,1
Livia Adami,dimmi dove cazzo stanno,1,8,12223200000,12236800000,13600000,230,1,0.0,1
Ezio Quirino,a casa di tua madre,1,8,12289600000,12302400000,12800000,231,0,1.0,1
Gabriele Marchilli,papà,1,8,12854400000,12863600000,9200000,234,0,1.0,1
Gabriele Marchilli,papà mi devi aiutare,1,8,12904400000,12916000000,11600000,235,0,1.0,1
Franco Marchilli,conta che sto per uscire,1,8,12933200000,12946000000,12800000,236,0,1.0,1
Gabriele Marchilli,ti racconto tutto,1,8,12978000000,12987600000,9600000,237,0,1.0,1
Gabriele Marchilli,senza bugie,1,8,13004000000,13012400000,8400000,238,0,1.0,1
Franco Marchilli,pure questa sarà una bugia,1,8,13067200000,13080800000,13600000,239,0,1.0,1
Gabriele Marchilli,stavolta no,1,8,13100000000,13117600000,17600000,240,0,1.0,1
Franco Marchilli,no,1,8,13100000000,13117600000,17600000,241,0,1.0,1
Franco Marchilli,lo spero per te perché non ho nessuna voglia di cacciarti pure da qua,1,8,13125600000,13156000000,30400000,242,0,1.0,1
Gabriele Marchilli,sono tutte storie del cazzo giri da poco,1,8,13213200000,13240000000,26800000,243,1,1.0,1
Franco Marchilli,ah sì,1,8,13240800000,13249200000,8400000,244,0,1.0,1
Franco Marchilli,pure il giro di samurai è un giro da poco,1,8,13285600000,13304800000,19200000,245,0,1.0,1
Gabriele Marchilli,mi hanno chiesto di partecipare a uno scambio stasera,1,8,13355200000,13378000000,22800000,246,0,1.0,1
Gabriele Marchilli,mezzo etto di coca,1,8,13386400000,13396000000,9600000,247,0,1.0,1
Gabriele Marchilli,lo devono portare due ragazzi,1,8,13413200000,13428400000,15200000,248,0,1.0,1
Gabriele Marchilli,senti un conto è qualche pippata a una festa,1,8,13464000000,13484800000,20800000,249,0,1.0,1
Gabriele Marchilli,ma io non ho mai spacciato in vita mia e non voglio cominciare stasera,1,8,13501200000,13532000000,30800000,250,0,1.0,1
Gabriele Marchilli,me la voglio riprendere in mano la vita mia,1,8,13540000000,13557600000,17600000,251,0,1.0,1
Franco Marchilli,basta ho capito,1,8,13558400000,13567200000,8800000,252,0,1.0,1
Franco Marchilli,stammi a sentire,1,8,13598800000,13609600000,10800000,253,0,1.0,1
Franco Marchilli,non ti faccio più domande,1,8,13622400000,13636000000,13600000,254,0,1.0,1
Franco Marchilli,tu conferma,1,8,13646000000,13654400000,8400000,255,0,1.0,1
Franco Marchilli,fa il tranquillo e conferma tutto,1,8,13658800000,13674400000,15600000,256,0,1.0,1
Franco Marchilli,poi te ne stai buono buono a casa,1,8,13678400000,13692800000,14400000,257,0,1.0,1
Franco Marchilli,e al posto tuo ci andiamo noi,1,8,13700800000,13713600000,12800000,258,0,1.0,1
Gabriele Marchilli,che succede,1,8,13714400000,13722800000,8400000,259,0,1.0,1
Franco Marchilli,succede che li prendiamo in flagranza di reato sti stronzi,1,8,13723600000,13754800000,31200000,260,0,1.0,1
Gabriele Marchilli,stronzi te l ho detto sono due ragazzi come me,1,8,13761600000,13783600000,22000000,261,0,1.0,1
Franco Marchilli,due ragazzi con mezzo etto di coca,1,8,13813600000,13830400000,16800000,262,0,1.0,1
Gabriele Marchilli,tu però mi prometti che ne resti fuori,1,8,13898400000,13917200000,18800000,263,0,1.0,1
Gabriele Marchilli,grazie,1,8,13972400000,13980800000,8400000,264,0,1.0,1
Franco Marchilli,a che ora dove come sono fatti,1,8,13981600000,14002800000,21200000,265,0,1.0,1
Gabriele Marchilli,alle dieci,1,8,14007200000,14015600000,8400000,266,0,1.0,1
Gabriele Marchilli,davanti alla chiesa dell isola tiberina,1,8,14025600000,14044000000,18400000,267,0,1.0,1
Gabriele Marchilli,uno è alto e biondo e l altro ha la cresta,1,8,14053600000,14074800000,21200000,268,0,1.0,1
Franco Marchilli,stammi a sentire,1,8,14149600000,14160400000,10800000,269,0,1.0,1
Franco Marchilli,io adesso faccio sta cosa,1,8,14184000000,14201600000,17600000,270,0,1.0,1
Franco Marchilli,poi tu però mi racconti per bene tutto,1,8,14220400000,14238400000,18000000,271,0,1.0,1
Franco Marchilli,di samurai e di sti giri di spaccio,1,8,14246800000,14266800000,20000000,272,0,1.0,1
Franco Marchilli,eh,1,8,14286400000,14294800000,8400000,273,0,1.0,1
Franco Marchilli,sistemiamo tutto gabrie,1,8,14336000000,14352000000,16000000,274,0,1.0,1
Franco Marchilli,tutto,1,8,14366000000,14374400000,8400000,275,0,1.0,1
Sandro Monaschi,allora,1,8,14431200000,14440400000,9200000,276,0,1.0,1
Sandro Monaschi,dimmi cosa hai ottenuto,1,8,14441200000,14457200000,16000000,277,0,1.0,1
Sara Monaschi,so solo che ce l avevamo quasi fatta,1,8,14492800000,14509200000,16400000,278,0,0.0,1
Sandro Monaschi,ti sei messa in affari con i peggiori criminali di roma,1,8,14510000000,14533200000,23200000,279,0,1.0,1
Sandro Monaschi,hai perso la testa hai perso tutto quello che avevamo,1,8,14541200000,14567200000,26000000,280,0,1.0,1
Sara Monaschi,forse una soluzione ancora c è,1,8,14609200000,14624800000,15600000,281,0,0.0,1
Sandro Monaschi,non credo,1,8,14628800000,14639600000,10800000,282,0,1.0,1
Sandro Monaschi,adesso devo tornare al lavoro,1,8,14659600000,14678400000,18800000,283,0,1.0,1
Sara Monaschi,ci devo provare,1,8,14736000000,14747200000,11200000,284,0,0.0,1
Sara Monaschi,arrivederci,1,8,14772000000,14780400000,8400000,285,0,0.0,1
Manfredi Anacleti,aiutami un po,1,8,14940400000,14953200000,12800000,287,0,1.0,1
Manfredi Anacleti,sei stata coraggiosa ieri,1,8,15062800000,15077200000,14400000,288,0,1.0,1
Manfredi Anacleti,sta cazzo di cravatta mi sta strozzando al manicomio mi manda,1,8,15113200000,15146800000,33600000,289,1,1.0,1
Angelica Sale,mo raccolgo tutto,1,8,15152800000,15166400000,13600000,290,0,0.0,1
Adelaide Anacleti,non fare confusione,1,8,15211200000,15221600000,10400000,291,0,0.0,1
Adelaide Anacleti,tuo marito è un altro,1,8,15244800000,15256800000,12000000,292,0,0.0,1
Angelica Sale,è tuo figlio che deve ricordarsi di avere una moglie,1,8,15261200000,15285600000,24400000,293,0,0.0,1
Adelaide Anacleti,mio figlio non ha nessun problema di memoria,1,8,15294800000,15320400000,25600000,294,0,0.0,1
Angelica Sale,mi sa che ce ne ha un altro di problema e pure bello grosso vero,1,8,15336000000,15366800000,30800000,295,0,0.0,1
Adelaide Anacleti,e tu stai qua per risolverlo,1,8,15371200000,15396000000,24800000,296,0,0.0,1
Angelica Sale,io non so che devo fare,1,8,15420000000,15438800000,18800000,297,0,0.0,1
Adelaide Anacleti,la moglie devi fare,1,8,15443200000,15457200000,14000000,298,0,0.0,1
Adelaide Anacleti,nient altro,1,8,15465200000,15474400000,9200000,299,0,0.0,1
Angelica Sale,ma se mio marito non mi vuole io qua che ci resto a fare,1,8,15478800000,15504800000,26000000,300,0,0.0,1
Adelaide Anacleti,se lo lasci ora mio figlio rischia la vita,1,8,15574800000,15610400000,35600000,301,0,0.0,1
Adelaide Anacleti,e tu di non contare più niente,1,8,15611200000,15631600000,20400000,302,0,0.0,1
Adelaide Anacleti,noi donne ragioniamo con la pancia,1,8,15675600000,15699200000,23600000,303,0,0.0,1
Adelaide Anacleti,e un modo per salvare il matrimonio lo troviamo sempre,1,8,15713200000,15744000000,30800000,304,0,0.0,1
Giacomo Finucci,chi è lei che vuole,1,8,16035600000,16044400000,8800000,305,0,1.0,1
Sara Monaschi,mi chiamo sara monaschi ho bisogno di parlare con lei,1,8,16045200000,16073200000,28000000,306,0,0.0,1
Giacomo Finucci,io sto ai domiciliari non posso far entrare nessuno,1,8,16074000000,16098000000,24000000,307,0,1.0,1
Sara Monaschi,io e lei abbiamo una cosa in comune,1,8,16098800000,16119200000,20400000,308,0,0.0,1
Sara Monaschi,samurai,1,8,16123600000,16132000000,8400000,309,0,0.0,1
Sara Monaschi,ci ha usati entrambi,1,8,16142000000,16156800000,14800000,310,0,0.0,1
Giacomo Finucci,non so di che parla arrivederci,1,8,16157600000,16174800000,17200000,311,0,1.0,1
Sara Monaschi,lavoro in vaticano e posso dargli molto fastidio,1,8,16175600000,16208400000,32800000,312,0,0.0,1
Sara Monaschi,ma mi serve qualcosa da poter usare contro di lui,1,8,16211600000,16232800000,21200000,313,0,0.0,1
Sara Monaschi,posso proteggerla,1,8,16242800000,16254400000,11600000,314,0,0.0,1
Giacomo Finucci,ha idea di chi ci sia dietro di lui nell affare del piano regolatore,1,8,16257200000,16287200000,30000000,315,0,1.0,1
Giacomo Finucci,se sono ancora vivo è perché non mi sono mai venute in mente cazzate del genere,1,8,16290400000,16325200000,34800000,316,1,1.0,1
Sara Monaschi,ma lei non deve esporsi,1,8,16326000000,16339600000,13600000,317,0,0.0,1
Sara Monaschi,mi deve dare qualcosa la faccia ce la metto io,1,8,16342800000,16364800000,22000000,318,0,0.0,1
Giacomo Finucci,la faccia in faccia ci sparano a tutti e due,1,8,16365600000,16391200000,25600000,319,0,1.0,1
Giacomo Finucci,quanto crede che ci metterebbe la mafia a capire che sono stato io a fotterli,1,8,16397200000,16428800000,31600000,320,0,1.0,1
Sara Monaschi,la mafia,1,8,16438800000,16448000000,9200000,321,0,0.0,1
Sara Monaschi,e allora mi dia una prova qualcosa,1,8,16463600000,16480800000,17200000,322,0,0.0,1
Giacomo Finucci,la trovi da sola,1,8,16481600000,16492800000,11200000,323,0,1.0,1
Giacomo Finucci,ma si sbrighi e per noi due forse c è ancora una speranza,1,8,16495600000,16531600000,36000000,324,0,1.0,1
Aureliano Adami,oh frate,1,8,16784800000,16795200000,10400000,325,0,1.0,1
Gabriele Marchilli,come va,1,8,16829200000,16842800000,13600000,326,0,1.0,1
Aureliano Adami,che dici,1,8,16829200000,16842800000,13600000,327,0,1.0,1
Gabriele Marchilli,bene e te,1,8,16843600000,16852800000,9200000,328,0,1.0,1
Aureliano Adami,come stiamo messi con la monaschi,1,8,16911200000,16928000000,16800000,329,0,1.0,1
Gabriele Marchilli,vi ho chiamato per questo,1,8,16928800000,16941200000,12400000,330,0,1.0,1
Gabriele Marchilli,sara ha organizzato una serata per la ratifica di sta firma,1,8,16956800000,16983200000,26400000,331,0,1.0,1
Gabriele Marchilli,ha bisogno di un bel po di merce,1,8,16987200000,17005600000,18400000,332,0,1.0,1
Alberto Anacleti,che problema c è ci pensiamo noi,1,8,17011600000,17035600000,24000000,333,0,1.0,1
Gabriele Marchilli,grazie,1,8,17011600000,17035600000,24000000,334,0,1.0,1
Aureliano Adami,dove ci vediamo,1,8,17057200000,17069600000,12400000,335,0,1.0,1
Gabriele Marchilli,alle dieci all isola tiberina,1,8,17070400000,17086400000,16000000,336,0,1.0,1
Alberto Anacleti,isola tiberina alle dieci sì,1,8,17094400000,17111600000,17200000,337,0,1.0,1
Aureliano Adami,va bene,1,8,17112400000,17123200000,10800000,338,0,1.0,1
Aureliano Adami,dove cazzo vai siediti facciamo un brindisi,1,8,17136400000,17154800000,18400000,339,1,1.0,1
Alberto Anacleti,qua tocca festeggiare,1,8,17155600000,17172000000,16400000,340,0,1.0,1
Aureliano Adami,dai belli,1,8,17182400000,17191200000,8800000,341,0,1.0,1
Aureliano Adami,va bene io ho un sacco di cazzi da fare mo mi organizzo pure per sta merce,1,8,17268400000,17299600000,31200000,342,1,1.0,1
Alberto Anacleti,andiamo finisci dopo sta birra,1,8,17307600000,17324000000,16400000,343,0,1.0,1
Aureliano Adami,forza ciao le,1,8,17327600000,17343600000,16000000,344,0,1.0,1
Alberto Anacleti,ciao bello,1,8,17327600000,17343600000,16000000,345,0,1.0,1
Sara Monaschi,il campidoglio,1,8,17530800000,17546800000,16000000,346,0,0.0,1
Sara Monaschi,me lo immaginavo più sfarzoso,1,8,17552000000,17568800000,16800000,347,0,0.0,1
Amedeo Cinaglia,beh lo è,1,8,17573600000,17584800000,11200000,348,0,1.0,1
Amedeo Cinaglia,solo non questo ufficio,1,8,17585600000,17598400000,12800000,349,0,1.0,1
